Name,Docket Link,Start Time,End Time,Number of Cases,Judge Name,Year,Month,Week,Date,Day,Number of Observers,Court Name
Thu 1-2-2025 @ 10:30 am — Harris County JP 1-1 w/Judge Carter — 35 Cases,https://jpwebsite.harriscountytx.gov/WebDockets/GetDocketDetail?date=01/02/2025&court=11&media=screen#1030AM,1/2/2025 10:30am,1/2/2025 11:30am,35,Judge Carter,2025,2025-01,2025-01,2025-01-02,Thursday,0,Harris County JP 1-1
Thu 1-2-2025 @ 2:00 pm — Harris County JP 1-1 w/Judge Carter — 32 Cases,https://jpwebsite.harriscountytx.gov/WebDockets/GetDocketDetail?date=01/02/2025&court=11&media=screen#0200PM,1/2/2025 2:00pm,1/2/2025 3:00pm,32,Judge Carter,2025,2025-01,2025-01,2025-01-02,Thursday,0,Harris County JP 1-1
Thu 1-2-2025 @ 1:00 pm — Harris County JP 1-1 w/Judge Carter — 39 Cases,https://jpwebsite.harriscountytx.gov/WebDockets/GetDocketDetail?date=01/02/2025&court=11&media=screen#0100PM,1/2/2025 1:00pm,1/2/2025 2:00pm,39,Judge Carter,2025,2025-01,2025-01,2025-01-02,Thursday,0,Harris County JP 1-1
Thu 1-2-2025 @ 3:00 pm — Harris County JP 1-1 w/Judge Carter — 32 Cases,https://jpwebsite.harriscountytx.gov/WebDockets/GetDocketDetail?date=01/02/2025&court=11&media=screen#0300PM,1/2/2025 3:00pm,1/2/2025 4:00pm,32,Judge Carter,2025,2025-01,2025-01,2025-01-02,Thursday,0,Harris County JP 1-1
Thu 1-2-2025 @ 8:30 am — Harris County JP 1-1 w/Judge Carter — 38 Cases,https://jpwebsite.harriscountytx.gov/WebDockets/GetDocketDetail?date=01/02/2025&court=11&media=screen#0830AM,1/2/2025 8:30am,1/2/2025 9:30am,38,Judge Carter,2025,2025-01,2025-01,2025-01-02,Thursday,0,Harris County JP 1-1
Thu 1-2-2025 @ 9:30 am — Harris County JP 1-1 w/Judge Carter — 37 Cases,https://jpwebsite.harriscountytx.gov/WebDockets/GetDocketDetail?date=01/02/2025&court=11&media=screen#0930AM,1/2/2025 9:30am,1/2/2025 10:30am,37,Judge Carter,2025,2025-01,2025-01,2025-01-02,Thursday,0,Harris County JP 1-1
Thu 1-2-2025 @ 8:00 am — Harris County JP 2-1 w/Judge Delgado — 19 Cases,https://jpwebsite.harriscountytx.gov/WebDockets/GetDocketDetail?date=01/02/2025&court=21&media=screen#0800AM,1/2/2025 8:00am,1/3/2025 9:00am,19,Judge Delgado,2025,2025-01,2025-01,2025-01-02,Thursday,0,Harris County JP 2-1
Thu 1-2-2025 @ 10:00 am — Harris County JP 2-2 w/Judge Lozano — 7 Cases,https://jpwebsite.harriscountytx.gov/WebDockets/GetDocketDetail?date=01/02/2025&court=22&media=screen#1000AM,1/2/2025 10:00am,1/2/2025 11:00am,7,Judge Lozano,2025,2025-01,2025-01,2025-01-02,Thursday,0,Harris County JP 2-2
Thu 1-2-2025 @ 9:00 am — Harris County JP 2-2 w/Judge Lozano — 38 Cases,https://jpwebsite.harriscountytx.gov/WebDockets/GetDocketDetail?date=01/02/2025&court=22&media=screen#0900AM,1/2/2025 9:00am,1/2/2025 10:00am,38,Judge Lozano,2025,2025-01,2025-01,2025-01-02,Thursday,0,Harris County JP 2-2
Thu 1-2-2025 @ 9:00 am — Harris County JP 4-1 w/Judge Goodwin — 18 Cases,https://jpwebsite.harriscountytx.gov/WebDockets/GetDocketDetail?date=01/02/2025&court=41&media=screen#0900AM,1/2/2025 9:00am,1/2/2025 10:00am,18,Judge Goodwin,2025,2025-01,2025-01,2025-01-02,Thursday,0,Harris County JP 4-1
Thu 1-2-2025 @ 2:30 pm — Harris County JP 5-2 w/Judge Wolfe — 94 Cases,https://jpwebsite.harriscountytx.gov/WebDockets/GetDocketDetail?date=01/02/2025&court=52&media=screen#0230PM,1/2/2025 2:30pm,1/2/2025 3:30pm,94,Judge Wolfe,2025,2025-01,2025-01,2025-01-02,Thursday,0,Harris County JP 5-2
Fri 1-3-2025 @ 9:00 am — Harris County JP 4-1 w/Judge Goodwin — 24 Cases,https://jpwebsite.harriscountytx.gov/WebDockets/GetDocketDetail?date=01/03/2025&court=41&media=screen#0900AM,1/3/2025 9:00am,1/3/2025 10:00am,24,Judge Goodwin,2025,2025-01,2025-01,2025-01-03,Friday,0,Harris County JP 4-1
Mon 1-6-2025 @ 8:00 am — Harris County JP 2-1 w/Judge Delgado — 20 Cases,https://jpwebsite.harriscountytx.gov/WebDockets/GetDocketDetail?date=01/06/2025&court=21&media=screen#0800AM,1/6/2025 8:00am,1/6/2025 11:30am,20,Judge Delgado,2025,2025-01,2025-02,2025-01-06,Monday,0,Harris County JP 2-1
Mon 1-6-2025 @ 1:00 pm — Harris County JP 4-1 w/Judge Goodwin — 92 Cases,https://jpwebsite.harriscountytx.gov/WebDockets/GetDocketDetail?date=01/06/2025&court=41&media=screen#0100PM,1/6/2025 1:00pm,1/6/2025 2:00pm,92,Judge Goodwin,2025,2025-01,2025-02,2025-01-06,Monday,0,Harris County JP 4-1
Mon 1-6-2025 @ 9:00 am — Harris County JP 4-1 w/Judge Goodwin — 67 Cases,https://jpwebsite.harriscountytx.gov/WebDockets/GetDocketDetail?date=01/06/2025&court=41&media=screen#0900AM,1/6/2025 9:00am,1/6/2025 10:00am,67,Judge Goodwin,2025,2025-01,2025-02,2025-01-06,Monday,0,Harris County JP 4-1
Mon 1-6-2025 @ 2:30 pm — Harris County JP 5-2 w/Judge Wolfe — 56 Cases,https://jpwebsite.harriscountytx.gov/WebDockets/GetDocketDetail?date=01/06/2025&court=52&media=screen#0230PM,1/6/2025 2:30pm,1/6/2025 3:00pm,56,Judge Wolfe,2025,2025-01,2025-02,2025-01-06,Monday,0,Harris County JP 5-2
Mon 1-6-2025 @ 9:00 am — Harris County JP 6-1 w/Judge Treviño — 58 Cases,https://jpwebsite.harriscountytx.gov/WebDockets/GetDocketDetail?date=01/06/2025&court=61&media=screen#0900AM,1/6/2025 9:00am,1/6/2025 2:00pm,58,Judge Treviño,2025,2025-01,2025-02,2025-01-06,Monday,0,Harris County JP 6-1
Mon 1-6-2025 @ 9:00 am — Harris County JP 6-2 w/Judge Rodriguez — 15 Cases,https://jpwebsite.harriscountytx.gov/WebDockets/GetDocketDetail?date=01/06/2025&court=62&media=screen#0900AM,1/6/2025 9:00am,,15,Judge Rodriguez,2025,2025-01,2025-02,2025-01-06,Monday,0,Harris County JP 6-2
Mon 1-6-2025 @ 1:00 pm — Harris County JP 8-1 w/Judge Williamson — 1 Cases,https://jpwebsite.harriscountytx.gov/WebDockets/GetDocketDetail?date=01/06/2025&court=81&media=screen#0100PM,1/6/2025 1:00pm,1/6/2025 2:00pm,1,Judge Williamson,2025,2025-01,2025-02,2025-01-06,Monday,0,Harris County JP 8-1
Mon 1-6-2025 @ 10:00 am — Harris County JP 8-1 w/Judge Williamson — 1 Cases,https://jpwebsite.harriscountytx.gov/WebDockets/GetDocketDetail?date=01/06/2025&court=81&media=screen#1000AM,1/6/2025 10:00am,1/6/2025 1:00pm,1,Judge Williamson,2025,2025-01,2025-02,2025-01-06,Monday,0,Harris County JP 8-1
Tue 1-7-2025 @ 10:30 am — Harris County JP 1-2 w/Judge Duble — 12 Cases,https://jpwebsite.harriscountytx.gov/WebDockets/GetDocketDetail?date=01/07/2025&court=12&media=screen#1030AM,1/7/2025 10:30am,1/7/2025 1:00pm,12,Judge Duble,2025,2025-01,2025-02,2025-01-07,Tuesday,0,Harris County JP 1-2
Tue 1-7-2025 @ 9:00 am — Harris County JP 1-2 w/Judge Duble — 11 Cases,https://jpwebsite.harriscountytx.gov/WebDockets/GetDocketDetail?date=01/07/2025&court=12&media=screen#0900AM,1/7/2025 9:00am,1/7/2025 10:30am,11,Judge Duble,2025,2025-01,2025-02,2025-01-07,Tuesday,0,Harris County JP 1-2
Tue 1-7-2025 @ 1:00 pm — Harris County JP 1-2 w/Judge Duble — 12 Cases,https://jpwebsite.harriscountytx.gov/WebDockets/GetDocketDetail?date=01/07/2025&court=12&media=screen#0100PM,1/7/2025 1:00pm,1/7/2025 1:30pm,12,Judge Duble,2025,2025-01,2025-02,2025-01-07,Tuesday,0,Harris County JP 1-2
Tue 1-7-2025 @ 9:00 am — Harris County JP 1-1 w/Judge Carter — 21 Cases,https://jpwebsite.harriscountytx.gov/WebDockets/GetDocketDetail?date=01/07/2025&court=11&media=screen#0900AM,1/7/2025 9:00am,1/7/2025 10:30am,21,Judge Carter,2025,2025-01,2025-02,2025-01-07,Tuesday,0,Harris County JP 1-1
Tue 1-7-2025 @ 10:30 am — Harris County JP 1-1 w/Judge Carter — 23 Cases,https://jpwebsite.harriscountytx.gov/WebDockets/GetDocketDetail?date=01/07/2025&court=11&media=screen#1030AM,1/7/2025 10:30am,1/7/2025 1:00pm,23,Judge Carter,2025,2025-01,2025-02,2025-01-07,Tuesday,0,Harris County JP 1-1
Tue 1-7-2025 @ 8:00 am — Harris County JP 2-1 w/Judge Delgado — 15 Cases,https://jpwebsite.harriscountytx.gov/WebDockets/GetDocketDetail?date=01/07/2025&court=21&media=screen#0800AM,1/7/2025 8:00am,1/7/2025 11:30am,15,Judge Delgado,2025,2025-01,2025-02,2025-01-07,Tuesday,0,Harris County JP 2-1
Tue 1-7-2025 @ 9:30 am — Harris County JP 3-2 w/Judge Bates — 18 Cases,https://jpwebsite.harriscountytx.gov/WebDockets/GetDocketDetail?date=01/07/2025&court=32&media=screen#0930AM,1/7/2025 9:30am,1/7/2025 10:00am,18,Judge Bates,2025,2025-01,2025-02,2025-01-07,Tuesday,0,Harris County JP 3-2
Tue 1-7-2025 @ 9:00 am — Harris County JP 4-1 w/Judge Goodwin — 87 Cases,https://jpwebsite.harriscountytx.gov/WebDockets/GetDocketDetail?date=01/07/2025&court=41&media=screen#0900AM,1/7/2025 9:00am,1/7/2025 10:00am,87,Judge Goodwin,2025,2025-01,2025-02,2025-01-07,Tuesday,0,Harris County JP 4-1
Tue 1-7-2025 @ 10:00 am — Harris County JP 4-2 w/Judge Korduba — 49 Cases,https://jpwebsite.harriscountytx.gov/WebDockets/GetDocketDetail?date=01/07/2025&court=42&media=screen#1000AM,1/7/2025 10:00am,1/7/2025 11:00am,49,Judge Korduba,2025,2025-01,2025-02,2025-01-07,Tuesday,0,Harris County JP 4-2
Tue 1-7-2025 @ 11:00 am — Harris County JP 4-2 w/Judge Korduba — 8 Cases,https://jpwebsite.harriscountytx.gov/WebDockets/GetDocketDetail?date=01/07/2025&court=42&media=screen#1100AM,1/7/2025 11:00am,1/7/2025 1:00pm,8,Judge Korduba,2025,2025-01,2025-02,2025-01-07,Tuesday,0,Harris County JP 4-2
Tue 1-7-2025 @ 1:00 pm — Harris County JP 4-2 w/Judge Korduba — 14 Cases,https://jpwebsite.harriscountytx.gov/WebDockets/GetDocketDetail?date=01/07/2025&court=42&media=screen#0100PM,1/7/2025 1:00pm,1/7/2025 2:00pm,14,Judge Korduba,2025,2025-01,2025-02,2025-01-07,Tuesday,0,Harris County JP 4-2
Tue 1-7-2025 @ 2:00 pm — Harris County JP 4-2 w/Judge Korduba — 20 Cases,https://jpwebsite.harriscountytx.gov/WebDockets/GetDocketDetail?date=01/07/2025&court=42&media=screen#0200PM,1/7/2025 2:00pm,1/7/2025 3:00pm,20,Judge Korduba,2025,2025-01,2025-02,2025-01-07,Tuesday,0,Harris County JP 4-2
Tue 1-7-2025 @ 8:00 am — Harris County JP 5-1 w/Judge Lombardino — 428 Cases,https://jpwebsite.harriscountytx.gov/WebDockets/GetDocketDetail?date=01/07/2025&court=51&media=screen#0800AM,1/7/2025 8:00am,1/7/2025 8:30am,428,Judge Lombardino,2025,2025-01,2025-02,2025-01-07,Tuesday,0,Harris County JP 5-1
Tue 1-7-2025 @ 1:00 pm — Harris County JP 5-1 w/Judge Lombardino — 302 Cases,https://jpwebsite.harriscountytx.gov/WebDockets/GetDocketDetail?date=01/07/2025&court=51&media=screen#0100PM,1/7/2025 1:00pm,1/7/2025 1:30pm,302,Judge Lombardino,2025,2025-01,2025-02,2025-01-07,Tuesday,0,Harris County JP 5-1
Tue 1-7-2025 @ 2:30 pm — Harris County JP 5-2 w/Judge Wolfe — 45 Cases,https://jpwebsite.harriscountytx.gov/WebDockets/GetDocketDetail?date=01/07/2025&court=52&media=screen#0230PM,1/7/2025 2:30pm,1/7/2025 3:00pm,45,Judge Wolfe,2025,2025-01,2025-02,2025-01-07,Tuesday,0,Harris County JP 5-2
Tue 1-7-2025 @ 9:00 am — Harris County JP 7-2 w/Judge Burney — 61 Cases,https://jpwebsite.harriscountytx.gov/WebDockets/GetDocketDetail?date=01/07/2025&court=72&media=screen#0900AM,1/7/2025 9:00am,1/7/2025 11:00am,61,Judge Burney,2025,2025-01,2025-02,2025-01-07,Tuesday,0,Harris County JP 7-2
Tue 1-7-2025 @ 11:00 am — Harris County JP 7-2 w/Judge Burney — 58 Cases,https://jpwebsite.harriscountytx.gov/WebDockets/GetDocketDetail?date=01/07/2025&court=72&media=screen#1100AM,1/7/2025 11:00am,1/7/2025 1:00pm,58,Judge Burney,2025,2025-01,2025-02,2025-01-07,Tuesday,0,Harris County JP 7-2
Tue 1-7-2025 @ 1:00 pm — Harris County JP 7-2 w/Judge Burney — 13 Cases,https://jpwebsite.harriscountytx.gov/WebDockets/GetDocketDetail?date=01/07/2025&court=72&media=screen#0100PM,1/7/2025 1:00pm,1/7/2025 2:00pm,13,Judge Burney,2025,2025-01,2025-02,2025-01-07,Tuesday,0,Harris County JP 7-2
Wed 1-8-2025 @ 1:00 pm — Harris County JP 1-1 w/Judge Carter — 22 Cases,https://jpwebsite.harriscountytx.gov/WebDockets/GetDocketDetail?date=01/08/2025&court=11&media=screen#0100PM,1/8/2025 1:00pm,1/8/2025 2:00pm,22,Judge Carter,2025,2025-01,2025-02,2025-01-08,Wednesday,0,Harris County JP 1-1
Wed 1-8-2025 @ 2:00 pm — Harris County JP 1-1 w/Judge Carter — 22 Cases,https://jpwebsite.harriscountytx.gov/WebDockets/GetDocketDetail?date=01/08/2025&court=11&media=screen#0200PM,1/8/2025 2:00pm,1/8/2025 3:00pm,22,Judge Carter,2025,2025-01,2025-02,2025-01-08,Wednesday,0,Harris County JP 1-1
Wed 1-8-2025 @ 3:00 pm — Harris County JP 1-1 w/Judge Carter — 18 Cases,https://jpwebsite.harriscountytx.gov/WebDockets/GetDocketDetail?date=01/08/2025&court=11&media=screen#0300PM,1/8/2025 3:00pm,1/8/2025 3:30pm,18,Judge Carter,2025,2025-01,2025-02,2025-01-08,Wednesday,0,Harris County JP 1-1
Wed 1-8-2025 @ 8:00 am — Harris County JP 2-1 w/Judge Delgado — 16 Cases,https://jpwebsite.harriscountytx.gov/WebDockets/GetDocketDetail?date=01/08/2025&court=21&media=screen#0800AM,1/8/2025 8:00am,1/8/2025 11:30am,16,Judge Delgado,2025,2025-01,2025-02,2025-01-08,Wednesday,0,Harris County JP 2-1
Wed 1-8-2025 @ 1:00 pm — Harris County JP 3-1 w/Judge Stephens — 37 Cases,https://jpwebsite.harriscountytx.gov/WebDockets/GetDocketDetail?date=01/08/2025&court=31&media=screen#0100PM,1/8/2025 1:00pm,1/8/2025 9:00am,37,Judge Stephens,2025,2025-01,2025-02,2025-01-08,Wednesday,0,Harris County JP 3-1
Wed 1-8-2025 @ 10:30 am — Harris County JP 3-1 w/Judge Stephens — 37 Cases,https://jpwebsite.harriscountytx.gov/WebDockets/GetDocketDetail?date=01/08/2025&court=31&media=screen#1030AM,1/8/2025 10:30am,1/8/2025 1:00pm,37,Judge Stephens,2025,2025-01,2025-02,2025-01-08,Wednesday,0,Harris County JP 3-1
Wed 1-8-2025 @ 9:00 am — Harris County JP 3-1 w/Judge Stephens — 42 Cases,https://jpwebsite.harriscountytx.gov/WebDockets/GetDocketDetail?date=01/08/2025&court=31&media=screen#0900AM,1/8/2025 9:00am,1/8/2025 10:30am,42,Judge Stephens,2025,2025-01,2025-02,2025-01-08,Wednesday,0,Harris County JP 3-1
Wed 1-8-2025 @ 2:30 pm — Harris County JP 5-2 w/Judge Wolfe — 29 Cases,https://jpwebsite.harriscountytx.gov/WebDockets/GetDocketDetail?date=01/08/2025&court=52&media=screen#0230PM,1/8/2025 2:30pm,1/8/2025 3:00pm,29,Judge Wolfe,2025,2025-01,2025-02,2025-01-08,Wednesday,0,Harris County JP 5-2
Thu 1-9-2025 @ 9:00 am — Harris County JP 1-1 w/Judge Carter — 30 Cases,https://jpwebsite.harriscountytx.gov/WebDockets/GetDocketDetail?date=01/09/2025&court=11&media=screen#0900AM,1/9/2025 9:00am,1/9/2025 9:30am,30,Judge Carter,2025,2025-01,2025-02,2025-01-09,Thursday,0,Harris County JP 1-1
Thu 1-9-2025 @ 8:00 am — Harris County JP 2-1 w/Judge Delgado — 18 Cases,https://jpwebsite.harriscountytx.gov/WebDockets/GetDocketDetail?date=01/09/2025&court=21&media=screen#0800AM,1/9/2025 8:00am,1/9/2025 11:30am,18,Judge Delgado,2025,2025-01,2025-02,2025-01-09,Thursday,0,Harris County JP 2-1
Thu 1-9-2025 @ 10:00 am — Harris County JP 2-2 w/Judge Lozano — 3 Cases,https://jpwebsite.harriscountytx.gov/WebDockets/GetDocketDetail?date=01/09/2025&court=22&media=screen#1000AM,1/9/2025 10:00am,1/9/2025 11:00am,3,Judge Lozano,2025,2025-01,2025-02,2025-01-09,Thursday,0,Harris County JP 2-2
Thu 1-9-2025 @ 9:00 am — Harris County JP 2-2 w/Judge Lozano — 5 Cases,https://jpwebsite.harriscountytx.gov/WebDockets/GetDocketDetail?date=01/09/2025&court=22&media=screen#0900AM,1/9/2025 9:00am,1/9/2025 10:00am,5,Judge Lozano,2025,2025-01,2025-02,2025-01-09,Thursday,0,Harris County JP 2-2
Thu 1-9-2025 @ 1:00 pm — Harris County JP 3-1 w/Judge Stephens — 27 Cases,https://jpwebsite.harriscountytx.gov/WebDockets/GetDocketDetail?date=01/09/2025&court=31&media=screen#0100PM,1/9/2025 1:00pm,1/9/2025 1:30pm,27,Judge Stephens,2025,2025-01,2025-02,2025-01-09,Thursday,0,Harris County JP 3-1
Thu 1-9-2025 @ 10:30 am — Harris County JP 3-1 w/Judge Stephens — 29 Cases,https://jpwebsite.harriscountytx.gov/WebDockets/GetDocketDetail?date=01/09/2025&court=31&media=screen#1030AM,1/9/2025 10:30am,1/9/2025 11:00am,29,Judge Stephens,2025,2025-01,2025-02,2025-01-09,Thursday,0,Harris County JP 3-1
Thu 1-9-2025 @ 9:00 am — Harris County JP 3-1 w/Judge Stephens — 36 Cases,https://jpwebsite.harriscountytx.gov/WebDockets/GetDocketDetail?date=01/09/2025&court=31&media=screen#0900AM,1/9/2025 9:00am,1/9/2025 10:30am,36,Judge Stephens,2025,2025-01,2025-02,2025-01-09,Thursday,0,Harris County JP 3-1
Thu 1-9-2025 @ 2:30 pm — Harris County JP 5-2 w/Judge Wolfe — 55 Cases,https://jpwebsite.harriscountytx.gov/WebDockets/GetDocketDetail?date=01/09/2025&court=52&media=screen#0230PM,1/9/2025 2:30pm,1/9/2025 3:00pm,55,Judge Wolfe,2025,2025-01,2025-02,2025-01-09,Thursday,0,Harris County JP 5-2
Thu 1-9-2025 @ 9:00 am — Harris County JP 8-1 w/Judge Williamson — 29 Cases,https://jpwebsite.harriscountytx.gov/WebDockets/GetDocketDetail?date=01/09/2025&court=81&media=screen#0900AM,1/9/2025 9:00am,1/9/2025 10:00am,29,Judge Williamson,2025,2025-01,2025-02,2025-01-09,Thursday,0,Harris County JP 8-1
Fri 1-10-2025 @ 9:00 am — Harris County JP 7-2 w/Judge Burney — 1 Cases,https://jpwebsite.harriscountytx.gov/WebDockets/GetDocketDetail?date=01/10/2025&court=72&media=screen#0900AM,1/10/2025 9:00am,1/10/2025 10:00am,1,Judge Burney,2025,2025-01,2025-02,2025-01-10,Friday,0,Harris County JP 7-2
Mon 1-13-2025 @ 8:30 am — Harris County JP 1-1 w/Judge Carter — 13 Cases,https://jpwebsite.harriscountytx.gov/WebDockets/GetDocketDetail?date=01/13/2025&court=11&media=screen#0830AM,1/13/2025 8:30am,1/13/2025 9:30am,13,Judge Carter,2025,2025-01,2025-03,2025-01-13,Monday,0,Harris County JP 1-1
Mon 1-13-2025 @ 9:30 am — Harris County JP 1-1 w/Judge Carter — 18 Cases,https://jpwebsite.harriscountytx.gov/WebDockets/GetDocketDetail?date=01/13/2025&court=11&media=screen#0930AM,1/13/2025 9:30am,1/13/2025 10:30am,18,Judge Carter,2025,2025-01,2025-03,2025-01-13,Monday,0,Harris County JP 1-1
Mon 1-13-2025 @ 10:30 am — Harris County JP 1-1 w/Judge Carter — 4 Cases,https://jpwebsite.harriscountytx.gov/WebDockets/GetDocketDetail?date=01/13/2025&court=11&media=screen#1030AM,1/13/2025 10:30am,1/13/2025 8:30am,4,Judge Carter,2025,2025-01,2025-03,2025-01-13,Monday,0,Harris County JP 1-1
Mon 1-13-2025 @ 8:00 am — Harris County JP 2-1 w/Judge Delgado — 20 Cases,https://jpwebsite.harriscountytx.gov/WebDockets/GetDocketDetail?date=01/13/2025&court=21&media=screen#0800AM,1/13/2025 8:00am,1/13/2025 9:00am,20,Judge Delgado,2025,2025-01,2025-03,2025-01-13,Monday,0,Harris County JP 2-1
Mon 1-13-2025 @ 9:00 am — Harris County JP 4-1 w/Judge Goodwin — 35 Cases,https://jpwebsite.harriscountytx.gov/WebDockets/GetDocketDetail?date=01/13/2025&court=41&media=screen#0900AM,1/13/2025 9:00am,1/13/2025 10:00am,35,Judge Goodwin,2025,2025-01,2025-03,2025-01-13,Monday,0,Harris County JP 4-1
Mon 1-13-2025 @ 1:00 pm — Harris County JP 4-1 w/Judge Goodwin — 130 Cases,https://jpwebsite.harriscountytx.gov/WebDockets/GetDocketDetail?date=01/13/2025&court=41&media=screen#0100PM,1/13/2025 1:00pm,1/13/2025 2:00pm,130,Judge Goodwin,2025,2025-01,2025-03,2025-01-13,Monday,0,Harris County JP 4-1
Mon 1-13-2025 @ 2:30 pm — Harris County JP 5-2 w/Judge Wolfe — 32 Cases,https://jpwebsite.harriscountytx.gov/WebDockets/GetDocketDetail?date=01/13/2025&court=52&media=screen#0230PM,1/13/2025 2:30pm,1/13/2025 3:00pm,32,Judge Wolfe,2025,2025-01,2025-03,2025-01-13,Monday,0,Harris County JP 5-2
Mon 1-13-2025 @ 9:00 am — Harris County JP 6-2 w/Judge Rodriguez — 9 Cases,https://jpwebsite.harriscountytx.gov/WebDockets/GetDocketDetail?date=01/13/2025&court=62&media=screen#0900AM,1/13/2025 9:00am,1/14/2025 9:00am,9,Judge Rodriguez,2025,2025-01,2025-03,2025-01-13,Monday,0,Harris County JP 6-2
Tue 1-14-2025 @ 10:30 am — Harris County JP 1-1 w/Judge Carter — 16 Cases,https://jpwebsite.harriscountytx.gov/WebDockets/GetDocketDetail?date=01/14/2025&court=11&media=screen#1030AM,1/14/2025 10:30am,1/14/2025 9:00am,16,Judge Carter,2025,2025-01,2025-03,2025-01-14,Tuesday,0,Harris County JP 1-1
Tue 1-14-2025 @ 9:30 am — Harris County JP 1-1 w/Judge Carter — 23 Cases,https://jpwebsite.harriscountytx.gov/WebDockets/GetDocketDetail?date=01/14/2025&court=11&media=screen#0930AM,1/14/2025 9:30am,1/14/2025 10:30am,23,Judge Carter,2025,2025-01,2025-03,2025-01-14,Tuesday,0,Harris County JP 1-1
Tue 1-14-2025 @ 8:30 am — Harris County JP 1-1 w/Judge Carter — 23 Cases,https://jpwebsite.harriscountytx.gov/WebDockets/GetDocketDetail?date=01/14/2025&court=11&media=screen#0830AM,1/14/2025 8:30am,1/14/2025 9:30am,23,Judge Carter,2025,2025-01,2025-03,2025-01-14,Tuesday,0,Harris County JP 1-1
Tue 1-14-2025 @ 10:30 am — Harris County JP 1-2 w/Judge Duble — 2 Cases,https://jpwebsite.harriscountytx.gov/WebDockets/GetDocketDetail?date=01/14/2025&court=12&media=screen#1030AM,1/14/2025 10:30am,1/14/2025 11:30am,2,Judge Duble,2025,2025-01,2025-03,2025-01-14,Tuesday,0,Harris County JP 1-2
Tue 1-14-2025 @ 9:00 am — Harris County JP 1-2 w/Judge Duble — 5 Cases,https://jpwebsite.harriscountytx.gov/WebDockets/GetDocketDetail?date=01/14/2025&court=12&media=screen#0900AM,1/14/2025 9:00am,1/14/2025 10:30am,5,Judge Duble,2025,2025-01,2025-03,2025-01-14,Tuesday,0,Harris County JP 1-2
Tue 1-14-2025 @ 8:00 am — Harris County JP 2-1 w/Judge Delgado — 18 Cases,https://jpwebsite.harriscountytx.gov/WebDockets/GetDocketDetail?date=01/14/2025&court=21&media=screen#0800AM,1/14/2025 8:00am,1/14/2025 9:00am,18,Judge Delgado,2025,2025-01,2025-03,2025-01-14,Tuesday,0,Harris County JP 2-1
Tue 1-14-2025 @ 9:00 am — Harris County JP 4-1 w/Judge Goodwin — 60 Cases,https://jpwebsite.harriscountytx.gov/WebDockets/GetDocketDetail?date=01/14/2025&court=41&media=screen#0900AM,1/14/2025 9:00am,1/14/2025 10:00am,60,Judge Goodwin,2025,2025-01,2025-03,2025-01-14,Tuesday,0,Harris County JP 4-1
Tue 1-14-2025 @ 10:00 am — Harris County JP 4-2 w/Judge Korduba — 43 Cases,https://jpwebsite.harriscountytx.gov/WebDockets/GetDocketDetail?date=01/14/2025&court=42&media=screen#1000AM,1/14/2025 10:00am,1/14/2025 11:00am,43,Judge Korduba,2025,2025-01,2025-03,2025-01-14,Tuesday,0,Harris County JP 4-2
Tue 1-14-2025 @ 11:00 am — Harris County JP 4-2 w/Judge Korduba — 11 Cases,https://jpwebsite.harriscountytx.gov/WebDockets/GetDocketDetail?date=01/14/2025&court=42&media=screen#1100AM,1/14/2025 11:00am,1/14/2025 1:00pm,11,Judge Korduba,2025,2025-01,2025-03,2025-01-14,Tuesday,0,Harris County JP 4-2
Tue 1-14-2025 @ 1:00 pm — Harris County JP 4-2 w/Judge Korduba — 22 Cases,https://jpwebsite.harriscountytx.gov/WebDockets/GetDocketDetail?date=01/14/2025&court=42&media=screen#0100PM,1/14/2025 1:00pm,1/14/2025 2:00pm,22,Judge Korduba,2025,2025-01,2025-03,2025-01-14,Tuesday,0,Harris County JP 4-2
Tue 1-14-2025 @ 2:00 pm — Harris County JP 4-2 w/Judge Korduba — 21 Cases,https://jpwebsite.harriscountytx.gov/WebDockets/GetDocketDetail?date=01/14/2025&court=42&media=screen#0200PM,1/14/2025 2:00pm,1/14/2025 3:00pm,21,Judge Korduba,2025,2025-01,2025-03,2025-01-14,Tuesday,0,Harris County JP 4-2
Tue 1-14-2025 @ 1:00 pm — Harris County JP 5-1 w/Judge Lombardino — 15 Cases,https://jpwebsite.harriscountytx.gov/WebDockets/GetDocketDetail?date=01/14/2025&court=51&media=screen#0100PM,1/14/2025 1:00pm,1/14/2025 1:30pm,15,Judge Lombardino,2025,2025-01,2025-03,2025-01-14,Tuesday,0,Harris County JP 5-1
Tue 1-14-2025 @ 8:00 am — Harris County JP 5-1 w/Judge Lombardino — 391 Cases,https://jpwebsite.harriscountytx.gov/WebDockets/GetDocketDetail?date=01/14/2025&court=51&media=screen#0800AM,1/14/2025 8:00am,1/14/2025 8:30am,391,Judge Lombardino,2025,2025-01,2025-03,2025-01-14,Tuesday,0,Harris County JP 5-1
Tue 1-14-2025 @ 2:30 pm — Harris County JP 5-2 w/Judge Wolfe — 2 Cases,https://jpwebsite.harriscountytx.gov/WebDockets/GetDocketDetail?date=01/14/2025&court=52&media=screen#0230PM,1/14/2025 2:30pm,1/14/2025 3:00pm,2,Judge Wolfe,2025,2025-01,2025-03,2025-01-14,Tuesday,0,Harris County JP 5-2
Tue 1-14-2025 @ 9:00 am — Harris County JP 7-2 w/Judge Burney — 55 Cases,https://jpwebsite.harriscountytx.gov/WebDockets/GetDocketDetail?date=01/14/2025&court=72&media=screen#0900AM,1/14/2025 9:00am,1/14/2025 11:00am,55,Judge Burney,2025,2025-01,2025-03,2025-01-14,Tuesday,0,Harris County JP 7-2
Tue 1-14-2025 @ 11:00 am — Harris County JP 7-2 w/Judge Burney — 40 Cases,https://jpwebsite.harriscountytx.gov/WebDockets/GetDocketDetail?date=01/14/2025&court=72&media=screen#1100AM,1/14/2025 11:00am,1/14/2025 1:00pm,40,Judge Burney,2025,2025-01,2025-03,2025-01-14,Tuesday,0,Harris County JP 7-2
Wed 1-15-2025 @ 8:00 am — Harris County JP 2-1 w/Judge Delgado — 20 Cases,https://jpwebsite.harriscountytx.gov/WebDockets/GetDocketDetail?date=01/15/2025&court=21&media=screen#0800AM,1/15/2025 8:00am,1/15/2025 9:00am,20,Judge Delgado,2025,2025-01,2025-03,2025-01-15,Wednesday,0,Harris County JP 2-1
Wed 1-15-2025 @ 9:00 am — Harris County JP 3-1 w/Judge Stephens — 33 Cases,https://jpwebsite.harriscountytx.gov/WebDockets/GetDocketDetail?date=01/15/2025&court=31&media=screen#0900AM,1/15/2025 9:00am,1/15/2025 10:30am,33,Judge Stephens,2025,2025-01,2025-03,2025-01-15,Wednesday,0,Harris County JP 3-1
Wed 1-15-2025 @ 10:30 am — Harris County JP 3-1 w/Judge Stephens — 29 Cases,https://jpwebsite.harriscountytx.gov/WebDockets/GetDocketDetail?date=01/15/2025&court=31&media=screen#1030AM,1/15/2025 10:30am,1/15/2025 11:00am,29,Judge Stephens,2025,2025-01,2025-03,2025-01-15,Wednesday,0,Harris County JP 3-1
Wed 1-15-2025 @ 9:00 am — Harris County JP 4-1 w/Judge Goodwin — 8 Cases,https://jpwebsite.harriscountytx.gov/WebDockets/GetDocketDetail?date=01/15/2025&court=41&media=screen#0900AM,1/15/2025 9:00am,1/15/2025 10:00am,8,Judge Goodwin,2025,2025-01,2025-03,2025-01-15,Wednesday,0,Harris County JP 4-1
Wed 1-15-2025 @ 9:00 am — Harris County JP 6-1 w/Judge Treviño — 29 Cases,https://jpwebsite.harriscountytx.gov/WebDockets/GetDocketDetail?date=01/15/2025&court=61&media=screen#0900AM,1/15/2025 9:00am,1/17/2025 8:00am,29,Judge Treviño,2025,2025-01,2025-03,2025-01-15,Wednesday,0,Harris County JP 6-1
Wed 1-15-2025 @ 9:00 am — Harris County JP 7-1 w/Judge Adams — 54 Cases,https://jpwebsite.harriscountytx.gov/WebDockets/GetDocketDetail?date=01/15/2025&court=71&media=screen#0900AM,1/15/2025 9:00am,1/15/2025 1:00pm,54,Judge Adams,2025,2025-01,2025-03,2025-01-15,Wednesday,0,Harris County JP 7-1
Wed 1-15-2025 @ 1:00 pm — Harris County JP 7-1 w/Judge Adams — 58 Cases,https://jpwebsite.harriscountytx.gov/WebDockets/GetDocketDetail?date=01/15/2025&court=71&media=screen#0100PM,1/15/2025 1:00pm,1/15/2025 1:30pm,58,Judge Adams,2025,2025-01,2025-03,2025-01-15,Wednesday,0,Harris County JP 7-1
Thu 1-16-2025 @ 3:00 pm — Harris County JP 1-1 w/Judge Carter — 23 Cases,https://jpwebsite.harriscountytx.gov/WebDockets/GetDocketDetail?date=01/16/2025&court=11&media=screen#0300PM,1/16/2025 3:00pm,1/16/2025 4:00pm,23,Judge Carter,2025,2025-01,2025-03,2025-01-16,Thursday,0,Harris County JP 1-1
Thu 1-16-2025 @ 9:00 am — Harris County JP 1-1 w/Judge Carter — 22 Cases,https://jpwebsite.harriscountytx.gov/WebDockets/GetDocketDetail?date=01/16/2025&court=11&media=screen#0900AM,1/16/2025 9:00am,1/16/2025 10:00am,22,Judge Carter,2025,2025-01,2025-03,2025-01-16,Thursday,0,Harris County JP 1-1
Thu 1-16-2025 @ 2:00 pm — Harris County JP 1-1 w/Judge Carter — 17 Cases,https://jpwebsite.harriscountytx.gov/WebDockets/GetDocketDetail?date=01/16/2025&court=11&media=screen#0200PM,1/16/2025 2:00pm,1/16/2025 3:00pm,17,Judge Carter,2025,2025-01,2025-03,2025-01-16,Thursday,0,Harris County JP 1-1
Thu 1-16-2025 @ 9:00 am — Harris County JP 2-2 w/Judge Lozano — 17 Cases,https://jpwebsite.harriscountytx.gov/WebDockets/GetDocketDetail?date=01/16/2025&court=22&media=screen#0900AM,1/16/2025 9:00am,1/16/2025 10:00am,17,Judge Lozano,2025,2025-01,2025-03,2025-01-16,Thursday,0,Harris County JP 2-2
Thu 1-16-2025 @ 9:00 am — Harris County JP 4-1 w/Judge Goodwin — 2 Cases,https://jpwebsite.harriscountytx.gov/WebDockets/GetDocketDetail?date=01/16/2025&court=41&media=screen#0900AM,1/16/2025 9:00am,1/16/2025 10:00am,2,Judge Goodwin,2025,2025-01,2025-03,2025-01-16,Thursday,0,Harris County JP 4-1
Thu 1-16-2025 @ 8:30 am — Harris County JP 5-1 w/Judge Lombardino — 37 Cases,https://jpwebsite.harriscountytx.gov/WebDockets/GetDocketDetail?date=01/16/2025&court=51&media=screen#0830AM,1/16/2025 8:30am,1/16/2025 9:00am,37,Judge Lombardino,2025,2025-01,2025-03,2025-01-16,Thursday,0,Harris County JP 5-1
Thu 1-16-2025 @ 2:30 pm — Harris County JP 5-2 w/Judge Wolfe — 104 Cases,https://jpwebsite.harriscountytx.gov/WebDockets/GetDocketDetail?date=01/16/2025&court=52&media=screen#0230PM,1/16/2025 2:30pm,1/16/2025 3:00pm,104,Judge Wolfe,2025,2025-01,2025-03,2025-01-16,Thursday,0,Harris County JP 5-2
Thu 1-16-2025 @ 9:00 am — Harris County JP 8-1 w/Judge Williamson — 26 Cases,https://jpwebsite.harriscountytx.gov/WebDockets/GetDocketDetail?date=01/16/2025&court=81&media=screen#0900AM,1/16/2025 9:00am,1/16/2025 10:00am,26,Judge Williamson,2025,2025-01,2025-03,2025-01-16,Thursday,0,Harris County JP 8-1
Fri 1-17-2025 @ 9:30 am — Harris County JP 3-2 w/Judge Bates — 9 Cases,https://jpwebsite.harriscountytx.gov/WebDockets/GetDocketDetail?date=01/17/2025&court=32&media=screen#0930AM,1/17/2025 9:30am,,9,Judge Bates,2025,2025-01,2025-03,2025-01-17,Friday,0,Harris County JP 3-2
Fri 1-17-2025 @ 8:30 am — Harris County JP 5-1 w/Judge Lombardino — 14 Cases,https://jpwebsite.harriscountytx.gov/WebDockets/GetDocketDetail?date=01/17/2025&court=51&media=screen#0830AM,1/17/2025 8:30am,1/17/2025 9:00am,14,Judge Lombardino,2025,2025-01,2025-03,2025-01-17,Friday,0,Harris County JP 5-1
Fri 1-17-2025 @ 9:00 am — Harris County JP 6-2 w/Judge Rodriguez — 12 Cases,https://jpwebsite.harriscountytx.gov/WebDockets/GetDocketDetail?date=01/17/2025&court=62&media=screen#0900AM,1/17/2025 9:00am,1/18/2025 9:00am,12,Judge Rodriguez,2025,2025-01,2025-03,2025-01-17,Friday,0,Harris County JP 6-2
Wed 1-22-2025 @ 1:30 pm — Harris County JP 3-2 w/Judge Bates — 9 Cases,https://jpwebsite.harriscountytx.gov/WebDockets/GetDocketDetail?date=01/22/2025&court=32&media=screen#0130PM,1/22/2025 1:30pm,1/23/2025 2:30pm,9,Judge Bates,2025,2025-01,2025-04,2025-01-22,Wednesday,0,Harris County JP 3-2
Thu 1-23-2025 @ 9:00 am — Harris County JP 1-1 w/Judge Carter — 26 Cases,https://jpwebsite.harriscountytx.gov/WebDockets/GetDocketDetail?date=01/23/2025&court=11&media=screen#0900AM,1/23/2025 9:00am,1/24/2025 1:00pm,26,Judge Carter,2025,2025-01,2025-04,2025-01-23,Thursday,0,Harris County JP 1-1
Thu 1-23-2025 @ 8:00 am — Harris County JP 2-1 w/Judge Delgado — 18 Cases,https://jpwebsite.harriscountytx.gov/WebDockets/GetDocketDetail?date=01/23/2025&court=21&media=screen#0800AM,1/23/2025 8:00am,1/23/2025 8:30am,18,Judge Delgado,2025,2025-01,2025-04,2025-01-23,Thursday,0,Harris County JP 2-1
Thu 1-23-2025 @ 9:00 am — Harris County JP 2-2 w/Judge Lozano — 15 Cases,https://jpwebsite.harriscountytx.gov/WebDockets/GetDocketDetail?date=01/23/2025&court=22&media=screen#0900AM,1/23/2025 9:00am,1/23/2025 11:00am,15,Judge Lozano,2025,2025-01,2025-04,2025-01-23,Thursday,0,Harris County JP 2-2
Thu 1-23-2025 @ 9:00 am — Harris County JP 4-1 w/Judge Goodwin — 42 Cases,https://jpwebsite.harriscountytx.gov/WebDockets/GetDocketDetail?date=01/23/2025&court=41&media=screen#0900AM,1/23/2025 9:00am,1/23/2025 11:00am,42,Judge Goodwin,2025,2025-01,2025-04,2025-01-23,Thursday,0,Harris County JP 4-1
Thu 1-23-2025 @ 11:00 am — Harris County JP 5-1 w/Judge Lombardino — 22 Cases,https://jpwebsite.harriscountytx.gov/WebDockets/GetDocketDetail?date=01/23/2025&court=51&media=screen#1100AM,1/23/2025 11:00am,1/24/2025 11:00am,22,Judge Lombardino,2025,2025-01,2025-04,2025-01-23,Thursday,0,Harris County JP 5-1
Thu 1-23-2025 @ 9:00 am — Harris County JP 5-1 w/Judge Lombardino — 31 Cases,https://jpwebsite.harriscountytx.gov/WebDockets/GetDocketDetail?date=01/23/2025&court=51&media=screen#0900AM,1/23/2025 9:00am,1/24/2025 9:00am,31,Judge Lombardino,2025,2025-01,2025-04,2025-01-23,Thursday,0,Harris County JP 5-1
Thu 1-23-2025 @ 2:30 pm — Harris County JP 5-2 w/Judge Wolfe — 68 Cases,https://jpwebsite.harriscountytx.gov/WebDockets/GetDocketDetail?date=01/23/2025&court=52&media=screen#0230PM,1/23/2025 2:30pm,1/23/2025 3:00pm,68,Judge Wolfe,2025,2025-01,2025-04,2025-01-23,Thursday,0,Harris County JP 5-2
Thu 1-23-2025 @ 9:30 am — Harris County JP 7-1 w/Judge Adams — 9 Cases,https://jpwebsite.harriscountytx.gov/WebDockets/GetDocketDetail?date=01/23/2025&court=71&media=screen#0930AM,1/23/2025 9:30am,1/24/2025 3:30pm,9,Judge Adams,2025,2025-01,2025-04,2025-01-23,Thursday,0,Harris County JP 7-1
Fri 1-24-2025 @ 9:00 am — Harris County JP 4-1 w/Judge Goodwin — 2 Cases,https://jpwebsite.harriscountytx.gov/WebDockets/GetDocketDetail?date=01/24/2025&court=41&media=screen#0900AM,1/24/2025 9:00am,1/24/2025 11:00am,2,Judge Goodwin,2025,2025-01,2025-04,2025-01-24,Friday,0,Harris County JP 4-1
Mon 1-27-2025 @ 3:00 pm — Harris County JP 1-1 w/Judge Carter — 3 Cases,https://jpwebsite.harriscountytx.gov/WebDockets/GetDocketDetail?date=01/27/2025&court=11&media=screen#0300PM,1/27/2025 3:00pm,1/27/2025 9:00am,3,Judge Carter,2025,2025-01,2025-05,2025-01-27,Monday,0,Harris County JP 1-1
Mon 1-27-2025 @ 1:00 pm — Harris County JP 1-1 w/Judge Carter — 21 Cases,https://jpwebsite.harriscountytx.gov/WebDockets/GetDocketDetail?date=01/27/2025&court=11&media=screen#0100PM,1/27/2025 1:00pm,1/27/2025 2:00pm,21,Judge Carter,2025,2025-01,2025-05,2025-01-27,Monday,0,Harris County JP 1-1
Mon 1-27-2025 @ 2:00 pm — Harris County JP 1-1 w/Judge Carter — 14 Cases,https://jpwebsite.harriscountytx.gov/WebDockets/GetDocketDetail?date=01/27/2025&court=11&media=screen#0200PM,1/27/2025 2:00pm,1/27/2025 3:00pm,14,Judge Carter,2025,2025-01,2025-05,2025-01-27,Monday,0,Harris County JP 1-1
Mon 1-27-2025 @ 8:00 am — Harris County JP 2-1 w/Judge Delgado — 19 Cases,https://jpwebsite.harriscountytx.gov/WebDockets/GetDocketDetail?date=01/27/2025&court=21&media=screen#0800AM,1/27/2025 8:00am,1/27/2025 8:30am,19,Judge Delgado,2025,2025-01,2025-05,2025-01-27,Monday,0,Harris County JP 2-1
Mon 1-27-2025 @ 1:00 pm — Harris County JP 4-1 w/Judge Goodwin — 108 Cases,https://jpwebsite.harriscountytx.gov/WebDockets/GetDocketDetail?date=01/27/2025&court=41&media=screen#0100PM,1/27/2025 1:00pm,1/27/2025 2:00pm,108,Judge Goodwin,2025,2025-01,2025-05,2025-01-27,Monday,0,Harris County JP 4-1
Mon 1-27-2025 @ 9:00 am — Harris County JP 4-1 w/Judge Goodwin — 103 Cases,https://jpwebsite.harriscountytx.gov/WebDockets/GetDocketDetail?date=01/27/2025&court=41&media=screen#0900AM,1/27/2025 9:00am,1/27/2025 10:00am,103,Judge Goodwin,2025,2025-01,2025-05,2025-01-27,Monday,0,Harris County JP 4-1
Mon 1-27-2025 @ 9:00 am — Harris County JP 5-1 w/Judge Lombardino — 124 Cases,https://jpwebsite.harriscountytx.gov/WebDockets/GetDocketDetail?date=01/27/2025&court=51&media=screen#0900AM,1/27/2025 9:00am,1/27/2025 9:30am,124,Judge Lombardino,2025,2025-01,2025-05,2025-01-27,Monday,0,Harris County JP 5-1
Mon 1-27-2025 @ 2:30 pm — Harris County JP 5-2 w/Judge Wolfe — 41 Cases,https://jpwebsite.harriscountytx.gov/WebDockets/GetDocketDetail?date=01/27/2025&court=52&media=screen#0230PM,1/27/2025 2:30pm,1/27/2025 3:30pm,41,Judge Wolfe,2025,2025-01,2025-05,2025-01-27,Monday,0,Harris County JP 5-2
Mon 1-27-2025 @ 9:00 am — Harris County JP 6-2 w/Judge Rodriguez — 10 Cases,https://jpwebsite.harriscountytx.gov/WebDockets/GetDocketDetail?date=01/27/2025&court=62&media=screen#0900AM,1/27/2025 9:00am,1/28/2025 9:00am,10,Judge Rodriguez,2025,2025-01,2025-05,2025-01-27,Monday,0,Harris County JP 6-2
Tue 1-28-2025 @ 1:00 pm — Harris County JP 1-1 w/Judge Carter — 23 Cases,https://jpwebsite.harriscountytx.gov/WebDockets/GetDocketDetail?date=01/28/2025&court=11&media=screen#0100PM,1/28/2025 1:00pm,1/28/2025 2:00pm,23,Judge Carter,2025,2025-01,2025-05,2025-01-28,Tuesday,0,Harris County JP 1-1
Tue 1-28-2025 @ 9:00 am — Harris County JP 1-1 w/Judge Carter — 21 Cases,https://jpwebsite.harriscountytx.gov/WebDockets/GetDocketDetail?date=01/28/2025&court=11&media=screen#0900AM,1/28/2025 9:00am,1/28/2025 10:30am,21,Judge Carter,2025,2025-01,2025-05,2025-01-28,Tuesday,0,Harris County JP 1-1
Tue 1-28-2025 @ 10:30 am — Harris County JP 1-1 w/Judge Carter — 32 Cases,https://jpwebsite.harriscountytx.gov/WebDockets/GetDocketDetail?date=01/28/2025&court=11&media=screen#1030AM,1/28/2025 10:30am,1/28/2025 1:00pm,32,Judge Carter,2025,2025-01,2025-05,2025-01-28,Tuesday,0,Harris County JP 1-1
Tue 1-28-2025 @ 2:00 pm — Harris County JP 1-1 w/Judge Carter — 20 Cases,https://jpwebsite.harriscountytx.gov/WebDockets/GetDocketDetail?date=01/28/2025&court=11&media=screen#0200PM,1/28/2025 2:00pm,1/28/2025 3:00pm,20,Judge Carter,2025,2025-01,2025-05,2025-01-28,Tuesday,0,Harris County JP 1-1
Tue 1-28-2025 @ 3:00 pm — Harris County JP 1-1 w/Judge Carter — 17 Cases,https://jpwebsite.harriscountytx.gov/WebDockets/GetDocketDetail?date=01/28/2025&court=11&media=screen#0300PM,1/28/2025 3:00pm,1/28/2025 1:00pm,17,Judge Carter,2025,2025-01,2025-05,2025-01-28,Tuesday,0,Harris County JP 1-1
Tue 1-28-2025 @ 9:00 am — Harris County JP 1-2 w/Judge Duble — 6 Cases,https://jpwebsite.harriscountytx.gov/WebDockets/GetDocketDetail?date=01/28/2025&court=12&media=screen#0900AM,1/28/2025 9:00am,1/28/2025 11:00am,6,Judge Duble,2025,2025-01,2025-05,2025-01-28,Tuesday,0,Harris County JP 1-2
Tue 1-28-2025 @ 8:00 am — Harris County JP 2-1 w/Judge Delgado — 15 Cases,https://jpwebsite.harriscountytx.gov/WebDockets/GetDocketDetail?date=01/28/2025&court=21&media=screen#0800AM,1/28/2025 8:00am,1/28/2025 8:30am,15,Judge Delgado,2025,2025-01,2025-05,2025-01-28,Tuesday,0,Harris County JP 2-1
Tue 1-28-2025 @ 9:30 am — Harris County JP 3-2 w/Judge Bates — 24 Cases,https://jpwebsite.harriscountytx.gov/WebDockets/GetDocketDetail?date=01/28/2025&court=32&media=screen#0930AM,1/28/2025 9:30am,1/29/2025 10:00am,24,Judge Bates,2025,2025-01,2025-05,2025-01-28,Tuesday,0,Harris County JP 3-2
Tue 1-28-2025 @ 1:30 pm — Harris County JP 4-1 w/Judge Goodwin — 58 Cases,https://jpwebsite.harriscountytx.gov/WebDockets/GetDocketDetail?date=01/28/2025&court=41&media=screen#0130PM,1/28/2025 1:30pm,1/28/2025 2:30pm,58,Judge Goodwin,2025,2025-01,2025-05,2025-01-28,Tuesday,0,Harris County JP 4-1
Tue 1-28-2025 @ 9:00 am — Harris County JP 4-1 w/Judge Goodwin — 67 Cases,https://jpwebsite.harriscountytx.gov/WebDockets/GetDocketDetail?date=01/28/2025&court=41&media=screen#0900AM,1/28/2025 9:00am,1/28/2025 10:00am,67,Judge Goodwin,2025,2025-01,2025-05,2025-01-28,Tuesday,0,Harris County JP 4-1
Tue 1-28-2025 @ 1:00 pm — Harris County JP 4-2 w/Judge Korduba — 15 Cases,https://jpwebsite.harriscountytx.gov/WebDockets/GetDocketDetail?date=01/28/2025&court=42&media=screen#0100PM,1/28/2025 1:00pm,1/28/2025 2:00pm,15,Judge Korduba,2025,2025-01,2025-05,2025-01-28,Tuesday,0,Harris County JP 4-2
Tue 1-28-2025 @ 10:00 am — Harris County JP 4-2 w/Judge Korduba — 23 Cases,https://jpwebsite.harriscountytx.gov/WebDockets/GetDocketDetail?date=01/28/2025&court=42&media=screen#1000AM,1/28/2025 10:00am,1/28/2025 11:00am,23,Judge Korduba,2025,2025-01,2025-05,2025-01-28,Tuesday,0,Harris County JP 4-2
Tue 1-28-2025 @ 11:00 am — Harris County JP 4-2 w/Judge Korduba — 14 Cases,https://jpwebsite.harriscountytx.gov/WebDockets/GetDocketDetail?date=01/28/2025&court=42&media=screen#1100AM,1/28/2025 11:00am,1/28/2025 1:00pm,14,Judge Korduba,2025,2025-01,2025-05,2025-01-28,Tuesday,0,Harris County JP 4-2
Tue 1-28-2025 @ 8:30 am — Harris County JP 4-2 w/Judge Korduba — 48 Cases,https://jpwebsite.harriscountytx.gov/WebDockets/GetDocketDetail?date=01/28/2025&court=42&media=screen#0830AM,1/28/2025 8:30am,1/28/2025 9:00am,48,Judge Korduba,2025,2025-01,2025-05,2025-01-28,Tuesday,0,Harris County JP 4-2
Tue 1-28-2025 @ 2:00 pm — Harris County JP 4-2 w/Judge Korduba — 13 Cases,https://jpwebsite.harriscountytx.gov/WebDockets/GetDocketDetail?date=01/28/2025&court=42&media=screen#0200PM,1/28/2025 2:00pm,1/28/2025 2:30pm,13,Judge Korduba,2025,2025-01,2025-05,2025-01-28,Tuesday,0,Harris County JP 4-2
Tue 1-28-2025 @ 8:00 am — Harris County JP 5-1 w/Judge Lombardino — 17 Cases,https://jpwebsite.harriscountytx.gov/WebDockets/GetDocketDetail?date=01/28/2025&court=51&media=screen#0800AM,1/28/2025 8:00am,1/28/2025 8:30am,17,Judge Lombardino,2025,2025-01,2025-05,2025-01-28,Tuesday,0,Harris County JP 5-1
Tue 1-28-2025 @ 1:00 pm — Harris County JP 5-1 w/Judge Lombardino — 27 Cases,https://jpwebsite.harriscountytx.gov/WebDockets/GetDocketDetail?date=01/28/2025&court=51&media=screen#0100PM,1/28/2025 1:00pm,1/28/2025 1:30pm,27,Judge Lombardino,2025,2025-01,2025-05,2025-01-28,Tuesday,0,Harris County JP 5-1
Tue 1-28-2025 @ 9:00 am — Harris County JP 5-1 w/Judge Lombardino — 26 Cases,https://jpwebsite.harriscountytx.gov/WebDockets/GetDocketDetail?date=01/28/2025&court=51&media=screen#0900AM,1/28/2025 9:00am,1/28/2025 9:30am,26,Judge Lombardino,2025,2025-01,2025-05,2025-01-28,Tuesday,0,Harris County JP 5-1
Tue 1-28-2025 @ 1:30 pm — Harris County JP 5-1 w/Judge Lombardino — 9 Cases,https://jpwebsite.harriscountytx.gov/WebDockets/GetDocketDetail?date=01/28/2025&court=51&media=screen#0130PM,1/28/2025 1:30pm,1/28/2025 2:00pm,9,Judge Lombardino,2025,2025-01,2025-05,2025-01-28,Tuesday,0,Harris County JP 5-1
Tue 1-28-2025 @ 11:00 am — Harris County JP 5-1 w/Judge Lombardino — 20 Cases,https://jpwebsite.harriscountytx.gov/WebDockets/GetDocketDetail?date=01/28/2025&court=51&media=screen#1100AM,1/28/2025 11:00am,1/28/2025 1:00pm,20,Judge Lombardino,2025,2025-01,2025-05,2025-01-28,Tuesday,0,Harris County JP 5-1
Tue 1-28-2025 @ 2:30 pm — Harris County JP 5-2 w/Judge Wolfe — 44 Cases,https://jpwebsite.harriscountytx.gov/WebDockets/GetDocketDetail?date=01/28/2025&court=52&media=screen#0230PM,1/28/2025 2:30pm,1/28/2025 3:30pm,44,Judge Wolfe,2025,2025-01,2025-05,2025-01-28,Tuesday,0,Harris County JP 5-2
Tue 1-28-2025 @ 11:00 am — Harris County JP 7-2 w/Judge Burney — 24 Cases,https://jpwebsite.harriscountytx.gov/WebDockets/GetDocketDetail?date=01/28/2025&court=72&media=screen#1100AM,1/28/2025 11:00am,1/28/2025 1:00pm,24,Judge Burney,2025,2025-01,2025-05,2025-01-28,Tuesday,0,Harris County JP 7-2
Tue 1-28-2025 @ 1:00 pm — Harris County JP 7-2 w/Judge Burney — 51 Cases,https://jpwebsite.harriscountytx.gov/WebDockets/GetDocketDetail?date=01/28/2025&court=72&media=screen#0100PM,1/28/2025 1:00pm,1/28/2025 3:00pm,51,Judge Burney,2025,2025-01,2025-05,2025-01-28,Tuesday,0,Harris County JP 7-2
Tue 1-28-2025 @ 9:00 am — Harris County JP 7-2 w/Judge Burney — 44 Cases,https://jpwebsite.harriscountytx.gov/WebDockets/GetDocketDetail?date=01/28/2025&court=72&media=screen#0900AM,1/28/2025 9:00am,1/28/2025 11:00am,44,Judge Burney,2025,2025-01,2025-05,2025-01-28,Tuesday,0,Harris County JP 7-2
Wed 1-29-2025 @ 1:00 pm — Harris County JP 1-1 w/Judge Carter — 28 Cases,https://jpwebsite.harriscountytx.gov/WebDockets/GetDocketDetail?date=01/29/2025&court=11&media=screen#0100PM,1/29/2025 1:00pm,1/29/2025 2:00pm,28,Judge Carter,2025,2025-01,2025-05,2025-01-29,Wednesday,0,Harris County JP 1-1
Wed 1-29-2025 @ 2:00 pm — Harris County JP 1-1 w/Judge Carter — 20 Cases,https://jpwebsite.harriscountytx.gov/WebDockets/GetDocketDetail?date=01/29/2025&court=11&media=screen#0200PM,1/29/2025 2:00pm,1/29/2025 3:00pm,20,Judge Carter,2025,2025-01,2025-05,2025-01-29,Wednesday,0,Harris County JP 1-1
Wed 1-29-2025 @ 3:00 pm — Harris County JP 1-1 w/Judge Carter — 18 Cases,https://jpwebsite.harriscountytx.gov/WebDockets/GetDocketDetail?date=01/29/2025&court=11&media=screen#0300PM,1/29/2025 3:00pm,1/29/2025 9:00am,18,Judge Carter,2025,2025-01,2025-05,2025-01-29,Wednesday,0,Harris County JP 1-1
Wed 1-29-2025 @ 2:00 pm — Harris County JP 2-1 w/Judge Delgado — 17 Cases,https://jpwebsite.harriscountytx.gov/WebDockets/GetDocketDetail?date=01/29/2025&court=21&media=screen#0200PM,1/29/2025 2:00pm,1/29/2025 2:30pm,17,Judge Delgado,2025,2025-01,2025-05,2025-01-29,Wednesday,0,Harris County JP 2-1
Wed 1-29-2025 @ 8:00 am — Harris County JP 2-1 w/Judge Delgado — 12 Cases,https://jpwebsite.harriscountytx.gov/WebDockets/GetDocketDetail?date=01/29/2025&court=21&media=screen#0800AM,1/29/2025 8:00am,1/29/2025 8:30am,12,Judge Delgado,2025,2025-01,2025-05,2025-01-29,Wednesday,0,Harris County JP 2-1
Wed 1-29-2025 @ 9:00 am — Harris County JP 2-1 w/Judge Delgado — 16 Cases,https://jpwebsite.harriscountytx.gov/WebDockets/GetDocketDetail?date=01/29/2025&court=21&media=screen#0900AM,1/29/2025 9:00am,1/29/2025 9:30am,16,Judge Delgado,2025,2025-01,2025-05,2025-01-29,Wednesday,0,Harris County JP 2-1
Wed 1-29-2025 @ 10:30 am — Harris County JP 3-1 w/Judge Stephens — 24 Cases,https://jpwebsite.harriscountytx.gov/WebDockets/GetDocketDetail?date=01/29/2025&court=31&media=screen#1030AM,1/29/2025 10:30am,1/29/2025 11:00am,24,Judge Stephens,2025,2025-01,2025-05,2025-01-29,Wednesday,0,Harris County JP 3-1
Wed 1-29-2025 @ 9:00 am — Harris County JP 3-1 w/Judge Stephens — 31 Cases,https://jpwebsite.harriscountytx.gov/WebDockets/GetDocketDetail?date=01/29/2025&court=31&media=screen#0900AM,1/29/2025 9:00am,1/29/2025 10:30am,31,Judge Stephens,2025,2025-01,2025-05,2025-01-29,Wednesday,0,Harris County JP 3-1
Wed 1-29-2025 @ 1:30 pm — Harris County JP 5-1 w/Judge Lombardino — 95 Cases,https://jpwebsite.harriscountytx.gov/WebDockets/GetDocketDetail?date=01/29/2025&court=51&media=screen#0130PM,1/29/2025 1:30pm,1/29/2025 2:00pm,95,Judge Lombardino,2025,2025-01,2025-05,2025-01-29,Wednesday,0,Harris County JP 5-1
Wed 1-29-2025 @ 9:00 am — Harris County JP 6-1 w/Judge Treviño — 16 Cases,https://jpwebsite.harriscountytx.gov/WebDockets/GetDocketDetail?date=01/29/2025&court=61&media=screen#0900AM,1/29/2025 9:00am,1/29/2025 1:00pm,16,Judge Treviño,2025,2025-01,2025-05,2025-01-29,Wednesday,0,Harris County JP 6-1
Wed 1-29-2025 @ 9:00 am — Harris County JP 7-1 w/Judge Adams — 42 Cases,https://jpwebsite.harriscountytx.gov/WebDockets/GetDocketDetail?date=01/29/2025&court=71&media=screen#0900AM,1/29/2025 9:00am,1/29/2025 9:30am,42,Judge Adams,2025,2025-01,2025-05,2025-01-29,Wednesday,0,Harris County JP 7-1
Wed 1-29-2025 @ 9:00 am — Harris County JP 8-1 w/Judge Williamson — 43 Cases,https://jpwebsite.harriscountytx.gov/WebDockets/GetDocketDetail?date=01/29/2025&court=81&media=screen#0900AM,1/29/2025 9:00am,1/29/2025 1:30pm,43,Judge Williamson,2025,2025-01,2025-05,2025-01-29,Wednesday,0,Harris County JP 8-1
Thu 1-30-2025 @ 9:00 am — Harris County JP 1-1 w/Judge Carter — 22 Cases,https://jpwebsite.harriscountytx.gov/WebDockets/GetDocketDetail?date=01/30/2025&court=11&media=screen#0900AM,1/30/2025 9:00am,1/30/2025 10:00am,22,Judge Carter,2025,2025-01,2025-05,2025-01-30,Thursday,0,Harris County JP 1-1
Thu 1-30-2025 @ 9:00 am — Harris County JP 2-2 w/Judge Lozano — 26 Cases,https://jpwebsite.harriscountytx.gov/WebDockets/GetDocketDetail?date=01/30/2025&court=22&media=screen#0900AM,1/30/2025 9:00am,1/30/2025 10:00am,26,Judge Lozano,2025,2025-01,2025-05,2025-01-30,Thursday,0,Harris County JP 2-2
Thu 1-30-2025 @ 9:00 am — Harris County JP 4-1 w/Judge Goodwin — 24 Cases,https://jpwebsite.harriscountytx.gov/WebDockets/GetDocketDetail?date=01/30/2025&court=41&media=screen#0900AM,1/30/2025 9:00am,1/30/2025 10:00am,24,Judge Goodwin,2025,2025-01,2025-05,2025-01-30,Thursday,0,Harris County JP 4-1
Thu 1-30-2025 @ 9:00 am — Harris County JP 5-1 w/Judge Lombardino — 32 Cases,https://jpwebsite.harriscountytx.gov/WebDockets/GetDocketDetail?date=01/30/2025&court=51&media=screen#0900AM,1/30/2025 9:00am,1/30/2025 9:30am,32,Judge Lombardino,2025,2025-01,2025-05,2025-01-30,Thursday,0,Harris County JP 5-1
Thu 1-30-2025 @ 11:00 am — Harris County JP 5-1 w/Judge Lombardino — 18 Cases,https://jpwebsite.harriscountytx.gov/WebDockets/GetDocketDetail?date=01/30/2025&court=51&media=screen#1100AM,1/30/2025 11:00am,1/30/2025 11:30am,18,Judge Lombardino,2025,2025-01,2025-05,2025-01-30,Thursday,0,Harris County JP 5-1
Thu 1-30-2025 @ 2:30 pm — Harris County JP 5-2 w/Judge Wolfe — 99 Cases,https://jpwebsite.harriscountytx.gov/WebDockets/GetDocketDetail?date=01/30/2025&court=52&media=screen#0230PM,1/30/2025 2:30pm,1/30/2025 3:30pm,99,Judge Wolfe,2025,2025-01,2025-05,2025-01-30,Thursday,0,Harris County JP 5-2
Thu 1-30-2025 @ 9:00 am — Harris County JP 7-1 w/Judge Adams — 11 Cases,https://jpwebsite.harriscountytx.gov/WebDockets/GetDocketDetail?date=01/30/2025&court=71&media=screen#0900AM,1/30/2025 9:00am,1/30/2025 9:30am,11,Judge Adams,2025,2025-01,2025-05,2025-01-30,Thursday,0,Harris County JP 7-1
Thu 1-30-2025 @ 9:00 am — Harris County JP 8-1 w/Judge Williamson — 83 Cases,https://jpwebsite.harriscountytx.gov/WebDockets/GetDocketDetail?date=01/30/2025&court=81&media=screen#0900AM,1/30/2025 9:00am,1/30/2025 1:30pm,83,Judge Williamson,2025,2025-01,2025-05,2025-01-30,Thursday,0,Harris County JP 8-1
Fri 1-31-2025 @ 9:00 am — Harris County JP 4-1 w/Judge Goodwin — 1 Cases,https://jpwebsite.harriscountytx.gov/WebDockets/GetDocketDetail?date=01/31/2025&court=41&media=screen#0900AM,1/31/2025 9:00am,1/31/2025 10:00am,1,Judge Goodwin,2025,2025-01,2025-05,2025-01-31,Friday,0,Harris County JP 4-1
Fri 1-31-2025 @ 9:00 am — Harris County JP 5-1 w/Judge Lombardino — 73 Cases,https://jpwebsite.harriscountytx.gov/WebDockets/GetDocketDetail?date=01/31/2025&court=51&media=screen#0900AM,1/31/2025 9:00am,1/31/2025 1:30pm,73,Judge Lombardino,2025,2025-01,2025-05,2025-01-31,Friday,0,Harris County JP 5-1
Fri 1-31-2025 @ 1:30 pm — Harris County JP 5-1 w/Judge Lombardino — 36 Cases,https://jpwebsite.harriscountytx.gov/WebDockets/GetDocketDetail?date=01/31/2025&court=51&media=screen#0130PM,1/31/2025 1:30pm,1/31/2025 2:00pm,36,Judge Lombardino,2025,2025-01,2025-05,2025-01-31,Friday,0,Harris County JP 5-1
Fri 1-31-2025 @ 2:30 pm — Harris County JP 5-2 w/Judge Wolfe — 2 Cases,https://jpwebsite.harriscountytx.gov/WebDockets/GetDocketDetail?date=01/31/2025&court=52&media=screen#0230PM,1/31/2025 2:30pm,1/31/2025 3:30pm,2,Judge Wolfe,2025,2025-01,2025-05,2025-01-31,Friday,0,Harris County JP 5-2
Fri 1-31-2025 @ 9:00 am — Harris County JP 6-2 w/Judge Rodriguez — 23 Cases,https://jpwebsite.harriscountytx.gov/WebDockets/GetDocketDetail?date=01/31/2025&court=62&media=screen#0900AM,1/31/2025 9:00am,2/1/2025 9:00am,23,Judge Rodriguez,2025,2025-01,2025-05,2025-01-31,Friday,0,Harris County JP 6-2
Mon 2-3-2025 @ 8:30 am — Harris County JP 1-1 w/Judge Carter — 26 Cases,https://jpwebsite.harriscountytx.gov/WebDockets/GetDocketDetail?date=02/03/2025&court=11&media=screen#0830AM,2/3/2025 8:30am,2/3/2025 9:30am,26,Judge Carter,2025,2025-02,2025-06,2025-02-03,Monday,0,Harris County JP 1-1
Mon 2-3-2025 @ 10:30 am — Harris County JP 1-1 w/Judge Carter — 10 Cases,https://jpwebsite.harriscountytx.gov/WebDockets/GetDocketDetail?date=02/03/2025&court=11&media=screen#1030AM,2/3/2025 10:30am,2/3/2025 11:00am,10,Judge Carter,2025,2025-02,2025-06,2025-02-03,Monday,0,Harris County JP 1-1
Mon 2-3-2025 @ 9:30 am — Harris County JP 1-1 w/Judge Carter — 23 Cases,https://jpwebsite.harriscountytx.gov/WebDockets/GetDocketDetail?date=02/03/2025&court=11&media=screen#0930AM,2/3/2025 9:30am,2/3/2025 10:30am,23,Judge Carter,2025,2025-02,2025-06,2025-02-03,Monday,0,Harris County JP 1-1
Mon 2-3-2025 @ 8:00 am — Harris County JP 2-1 w/Judge Delgado — 20 Cases,https://jpwebsite.harriscountytx.gov/WebDockets/GetDocketDetail?date=02/03/2025&court=21&media=screen#0800AM,2/3/2025 8:00am,2/3/2025 9:00am,20,Judge Delgado,2025,2025-02,2025-06,2025-02-03,Monday,0,Harris County JP 2-1
Mon 2-3-2025 @ 9:00 am — Harris County JP 2-1 w/Judge Delgado — 14 Cases,https://jpwebsite.harriscountytx.gov/WebDockets/GetDocketDetail?date=02/03/2025&court=21&media=screen#0900AM,2/3/2025 9:00am,2/3/2025 9:10am,14,Judge Delgado,2025,2025-02,2025-06,2025-02-03,Monday,0,Harris County JP 2-1
Mon 2-3-2025 @ 1:30 pm — Harris County JP 3-2 w/Judge Bates — 9 Cases,https://jpwebsite.harriscountytx.gov/WebDockets/GetDocketDetail?date=02/03/2025&court=32&media=screen#0130PM,2/3/2025 1:30pm,2/3/2025 5:30pm,9,Judge Bates,2025,2025-02,2025-06,2025-02-03,Monday,0,Harris County JP 3-2
Mon 2-3-2025 @ 9:30 am — Harris County JP 3-2 w/Judge Bates — 18 Cases,https://jpwebsite.harriscountytx.gov/WebDockets/GetDocketDetail?date=02/03/2025&court=32&media=screen#0930AM,2/3/2025 9:30am,2/3/2025 1:30pm,18,Judge Bates,2025,2025-02,2025-06,2025-02-03,Monday,0,Harris County JP 3-2
Mon 2-3-2025 @ 1:00 pm — Harris County JP 4-1 w/Judge Goodwin — 23 Cases,https://jpwebsite.harriscountytx.gov/WebDockets/GetDocketDetail?date=02/03/2025&court=41&media=screen#0100PM,2/3/2025 1:00pm,2/3/2025 2:00pm,23,Judge Goodwin,2025,2025-02,2025-06,2025-02-03,Monday,0,Harris County JP 4-1
Mon 2-3-2025 @ 9:00 am — Harris County JP 4-1 w/Judge Goodwin — 68 Cases,https://jpwebsite.harriscountytx.gov/WebDockets/GetDocketDetail?date=02/03/2025&court=41&media=screen#0900AM,2/3/2025 9:00am,2/3/2025 10:00am,68,Judge Goodwin,2025,2025-02,2025-06,2025-02-03,Monday,0,Harris County JP 4-1
Mon 2-3-2025 @ 2:30 pm — Harris County JP 5-2 w/Judge Wolfe — 45 Cases,https://jpwebsite.harriscountytx.gov/WebDockets/GetDocketDetail?date=02/03/2025&court=52&media=screen#0230PM,2/3/2025 2:30pm,2/3/2025 3:00pm,45,Judge Wolfe,2025,2025-02,2025-06,2025-02-03,Monday,0,Harris County JP 5-2
Mon 2-3-2025 @ 9:00 am — Harris County JP 6-2 w/Judge Rodriguez — 10 Cases,https://jpwebsite.harriscountytx.gov/WebDockets/GetDocketDetail?date=02/03/2025&court=62&media=screen#0900AM,2/3/2025 9:00am,2/3/2025 11:00am,10,Judge Rodriguez,2025,2025-02,2025-06,2025-02-03,Monday,0,Harris County JP 6-2
Tue 2-4-2025 @ 9:00 am — Harris County JP 1-1 w/Judge Carter — 22 Cases,https://jpwebsite.harriscountytx.gov/WebDockets/GetDocketDetail?date=02/04/2025&court=11&media=screen#0900AM,2/4/2025 9:00am,2/4/2025 9:30am,22,Judge Carter,2025,2025-02,2025-06,2025-02-04,Tuesday,0,Harris County JP 1-1
Tue 2-4-2025 @ 2:00 pm — Harris County JP 1-2 w/Judge Duble — 1 Cases,https://jpwebsite.harriscountytx.gov/WebDockets/GetDocketDetail?date=02/04/2025&court=12&media=screen#0200PM,2/4/2025 2:00pm,2/4/2025 2:30pm,1,Judge Duble,2025,2025-02,2025-06,2025-02-04,Tuesday,0,Harris County JP 1-2
Tue 2-4-2025 @ 10:30 am — Harris County JP 1-2 w/Judge Duble — 6 Cases,https://jpwebsite.harriscountytx.gov/WebDockets/GetDocketDetail?date=02/04/2025&court=12&media=screen#1030AM,2/4/2025 10:30am,2/4/2025 1:00pm,6,Judge Duble,2025,2025-02,2025-06,2025-02-04,Tuesday,0,Harris County JP 1-2
Tue 2-4-2025 @ 9:00 am — Harris County JP 1-2 w/Judge Duble — 17 Cases,https://jpwebsite.harriscountytx.gov/WebDockets/GetDocketDetail?date=02/04/2025&court=12&media=screen#0900AM,2/4/2025 9:00am,2/4/2025 10:30am,17,Judge Duble,2025,2025-02,2025-06,2025-02-04,Tuesday,0,Harris County JP 1-2
Tue 2-4-2025 @ 1:00 pm — Harris County JP 1-2 w/Judge Duble — 9 Cases,https://jpwebsite.harriscountytx.gov/WebDockets/GetDocketDetail?date=02/04/2025&court=12&media=screen#0100PM,2/4/2025 1:00pm,2/4/2025 2:00pm,9,Judge Duble,2025,2025-02,2025-06,2025-02-04,Tuesday,0,Harris County JP 1-2
Tue 2-4-2025 @ 9:00 am — Harris County JP 4-1 w/Judge Goodwin — 36 Cases,https://jpwebsite.harriscountytx.gov/WebDockets/GetDocketDetail?date=02/04/2025&court=41&media=screen#0900AM,2/4/2025 9:00am,2/4/2025 10:00am,36,Judge Goodwin,2025,2025-02,2025-06,2025-02-04,Tuesday,0,Harris County JP 4-1
Tue 2-4-2025 @ 1:00 pm — Harris County JP 4-2 w/Judge Korduba — 5 Cases,https://jpwebsite.harriscountytx.gov/WebDockets/GetDocketDetail?date=02/04/2025&court=42&media=screen#0100PM,2/4/2025 1:00pm,2/4/2025 2:00pm,5,Judge Korduba,2025,2025-02,2025-06,2025-02-04,Tuesday,0,Harris County JP 4-2
Tue 2-4-2025 @ 11:00 am — Harris County JP 4-2 w/Judge Korduba — 2 Cases,https://jpwebsite.harriscountytx.gov/WebDockets/GetDocketDetail?date=02/04/2025&court=42&media=screen#1100AM,2/4/2025 11:00am,2/4/2025 1:00pm,2,Judge Korduba,2025,2025-02,2025-06,2025-02-04,Tuesday,0,Harris County JP 4-2
Tue 2-4-2025 @ 10:00 am — Harris County JP 4-2 w/Judge Korduba — 27 Cases,https://jpwebsite.harriscountytx.gov/WebDockets/GetDocketDetail?date=02/04/2025&court=42&media=screen#1000AM,2/4/2025 10:00am,2/4/2025 11:00am,27,Judge Korduba,2025,2025-02,2025-06,2025-02-04,Tuesday,0,Harris County JP 4-2
Tue 2-4-2025 @ 11:00 am — Harris County JP 5-1 w/Judge Lombardino — 30 Cases,https://jpwebsite.harriscountytx.gov/WebDockets/GetDocketDetail?date=02/04/2025&court=51&media=screen#1100AM,2/4/2025 11:00am,2/4/2025 2:30pm,30,Judge Lombardino,2025,2025-02,2025-06,2025-02-04,Tuesday,0,Harris County JP 5-1
Tue 2-4-2025 @ 9:30 am — Harris County JP 5-1 w/Judge Lombardino — 41 Cases,https://jpwebsite.harriscountytx.gov/WebDockets/GetDocketDetail?date=02/04/2025&court=51&media=screen#0930AM,2/4/2025 9:30am,2/4/2025 10:00am,41,Judge Lombardino,2025,2025-02,2025-06,2025-02-04,Tuesday,0,Harris County JP 5-1
Tue 2-4-2025 @ 2:30 pm — Harris County JP 5-1 w/Judge Lombardino — 20 Cases,https://jpwebsite.harriscountytx.gov/WebDockets/GetDocketDetail?date=02/04/2025&court=51&media=screen#0230PM,2/4/2025 2:30pm,2/4/2025 8:00am,20,Judge Lombardino,2025,2025-02,2025-06,2025-02-04,Tuesday,0,Harris County JP 5-1
Tue 2-4-2025 @ 2:30 pm — Harris County JP 5-2 w/Judge Wolfe — 42 Cases,https://jpwebsite.harriscountytx.gov/WebDockets/GetDocketDetail?date=02/04/2025&court=52&media=screen#0230PM,2/4/2025 2:30pm,2/4/2025 3:00pm,42,Judge Wolfe,2025,2025-02,2025-06,2025-02-04,Tuesday,0,Harris County JP 5-2
Tue 2-4-2025 @ 11:00 am — Harris County JP 7-2 w/Judge Burney — 52 Cases,https://jpwebsite.harriscountytx.gov/WebDockets/GetDocketDetail?date=02/04/2025&court=72&media=screen#1100AM,2/4/2025 11:00am,2/5/2025 8:30am,52,Judge Burney,2025,2025-02,2025-06,2025-02-04,Tuesday,0,Harris County JP 7-2
Tue 2-4-2025 @ 9:00 am — Harris County JP 7-2 w/Judge Burney — 48 Cases,https://jpwebsite.harriscountytx.gov/WebDockets/GetDocketDetail?date=02/04/2025&court=72&media=screen#0900AM,2/4/2025 9:00am,2/4/2025 11:00am,48,Judge Burney,2025,2025-02,2025-06,2025-02-04,Tuesday,0,Harris County JP 7-2
Wed 2-5-2025 @ 9:30 am — Harris County JP 1-1 w/Judge Carter — 25 Cases,https://jpwebsite.harriscountytx.gov/WebDockets/GetDocketDetail?date=02/05/2025&court=11&media=screen#0930AM,2/5/2025 9:30am,2/5/2025 10:30am,25,Judge Carter,2025,2025-02,2025-06,2025-02-05,Wednesday,0,Harris County JP 1-1
Wed 2-5-2025 @ 10:30 am — Harris County JP 1-1 w/Judge Carter — 21 Cases,https://jpwebsite.harriscountytx.gov/WebDockets/GetDocketDetail?date=02/05/2025&court=11&media=screen#1030AM,2/5/2025 10:30am,2/5/2025 11:00am,21,Judge Carter,2025,2025-02,2025-06,2025-02-05,Wednesday,0,Harris County JP 1-1
Wed 2-5-2025 @ 8:30 am — Harris County JP 1-1 w/Judge Carter — 25 Cases,https://jpwebsite.harriscountytx.gov/WebDockets/GetDocketDetail?date=02/05/2025&court=11&media=screen#0830AM,2/5/2025 8:30am,2/5/2025 9:30am,25,Judge Carter,2025,2025-02,2025-06,2025-02-05,Wednesday,0,Harris County JP 1-1
Wed 2-5-2025 @ 10:30 am — Harris County JP 3-1 w/Judge Stephens — 30 Cases,https://jpwebsite.harriscountytx.gov/WebDockets/GetDocketDetail?date=02/05/2025&court=31&media=screen#1030AM,2/5/2025 10:30am,2/6/2025 10:00am,30,Judge Stephens,2025,2025-02,2025-06,2025-02-05,Wednesday,0,Harris County JP 3-1
Wed 2-5-2025 @ 9:00 am — Harris County JP 3-1 w/Judge Stephens — 37 Cases,https://jpwebsite.harriscountytx.gov/WebDockets/GetDocketDetail?date=02/05/2025&court=31&media=screen#0900AM,2/5/2025 9:00am,2/5/2025 10:30am,37,Judge Stephens,2025,2025-02,2025-06,2025-02-05,Wednesday,0,Harris County JP 3-1
Wed 2-5-2025 @ 8:00 am — Harris County JP 5-1 w/Judge Lombardino — 1 Cases,https://jpwebsite.harriscountytx.gov/WebDockets/GetDocketDetail?date=02/05/2025&court=51&media=screen#0800AM,2/5/2025 8:00am,2/5/2025 8:30am,1,Judge Lombardino,2025,2025-02,2025-06,2025-02-05,Wednesday,0,Harris County JP 5-1
Wed 2-5-2025 @ 2:30 pm — Harris County JP 5-2 w/Judge Wolfe — 24 Cases,https://jpwebsite.harriscountytx.gov/WebDockets/GetDocketDetail?date=02/05/2025&court=52&media=screen#0230PM,2/5/2025 2:30pm,2/5/2025 3:00pm,24,Judge Wolfe,2025,2025-02,2025-06,2025-02-05,Wednesday,0,Harris County JP 5-2
Wed 2-5-2025 @ 9:00 am — Harris County JP 6-1 w/Judge Treviño — 44 Cases,https://jpwebsite.harriscountytx.gov/WebDockets/GetDocketDetail?date=02/05/2025&court=61&media=screen#0900AM,2/5/2025 9:00am,2/5/2025 1:00pm,44,Judge Treviño,2025,2025-02,2025-06,2025-02-05,Wednesday,0,Harris County JP 6-1
Wed 2-5-2025 @ 9:00 am — Harris County JP 7-1 w/Judge Adams — 38 Cases,https://jpwebsite.harriscountytx.gov/WebDockets/GetDocketDetail?date=02/05/2025&court=71&media=screen#0900AM,2/5/2025 9:00am,2/6/2025 9:00am,38,Judge Adams,2025,2025-02,2025-06,2025-02-05,Wednesday,0,Harris County JP 7-1
Thu 2-6-2025 @ 9:00 am — Harris County JP 1-1 w/Judge Carter — 22 Cases,https://jpwebsite.harriscountytx.gov/WebDockets/GetDocketDetail?date=02/06/2025&court=11&media=screen#0900AM,2/6/2025 9:00am,2/6/2025 9:30am,22,Judge Carter,2025,2025-02,2025-06,2025-02-06,Thursday,0,Harris County JP 1-1
Thu 2-6-2025 @ 8:00 am — Harris County JP 2-1 w/Judge Delgado — 15 Cases,https://jpwebsite.harriscountytx.gov/WebDockets/GetDocketDetail?date=02/06/2025&court=21&media=screen#0800AM,2/6/2025 8:00am,2/6/2025 8:10am,15,Judge Delgado,2025,2025-02,2025-06,2025-02-06,Thursday,0,Harris County JP 2-1
Thu 2-6-2025 @ 9:00 am — Harris County JP 2-2 w/Judge Lozano — 17 Cases,https://jpwebsite.harriscountytx.gov/WebDockets/GetDocketDetail?date=02/06/2025&court=22&media=screen#0900AM,2/6/2025 9:00am,2/6/2025 9:30am,17,Judge Lozano,2025,2025-02,2025-06,2025-02-06,Thursday,0,Harris County JP 2-2
Thu 2-6-2025 @ 9:00 am — Harris County JP 4-1 w/Judge Goodwin — 4 Cases,https://jpwebsite.harriscountytx.gov/WebDockets/GetDocketDetail?date=02/06/2025&court=41&media=screen#0900AM,2/6/2025 9:00am,2/6/2025 10:00am,4,Judge Goodwin,2025,2025-02,2025-06,2025-02-06,Thursday,0,Harris County JP 4-1
Thu 2-6-2025 @ 9:00 am — Harris County JP 5-1 w/Judge Lombardino — 38 Cases,https://jpwebsite.harriscountytx.gov/WebDockets/GetDocketDetail?date=02/06/2025&court=51&media=screen#0900AM,2/6/2025 9:00am,2/6/2025 9:30am,38,Judge Lombardino,2025,2025-02,2025-06,2025-02-06,Thursday,0,Harris County JP 5-1
Thu 2-6-2025 @ 11:00 am — Harris County JP 5-1 w/Judge Lombardino — 34 Cases,https://jpwebsite.harriscountytx.gov/WebDockets/GetDocketDetail?date=02/06/2025&court=51&media=screen#1100AM,2/6/2025 11:00am,2/6/2025 11:30am,34,Judge Lombardino,2025,2025-02,2025-06,2025-02-06,Thursday,0,Harris County JP 5-1
Thu 2-6-2025 @ 2:30 pm — Harris County JP 5-2 w/Judge Wolfe — 42 Cases,https://jpwebsite.harriscountytx.gov/WebDockets/GetDocketDetail?date=02/06/2025&court=52&media=screen#0230PM,2/6/2025 2:30pm,2/6/2025 3:00pm,42,Judge Wolfe,2025,2025-02,2025-06,2025-02-06,Thursday,0,Harris County JP 5-2
Thu 2-6-2025 @ 1:00 pm — Harris County JP 6-2 w/Judge Rodriguez — 1 Cases,https://jpwebsite.harriscountytx.gov/WebDockets/GetDocketDetail?date=02/06/2025&court=62&media=screen#0100PM,2/6/2025 1:00pm,2/6/2025 8:00am,1,Judge Rodriguez,2025,2025-02,2025-06,2025-02-06,Thursday,0,Harris County JP 6-2
Thu 2-6-2025 @ 1:00 pm — Harris County JP 7-1 w/Judge Adams — 57 Cases,https://jpwebsite.harriscountytx.gov/WebDockets/GetDocketDetail?date=02/06/2025&court=71&media=screen#0100PM,2/6/2025 1:00pm,2/7/2025 1:00pm,57,Judge Adams,2025,2025-02,2025-06,2025-02-06,Thursday,0,Harris County JP 7-1
Thu 2-6-2025 @ 9:00 am — Harris County JP 7-1 w/Judge Adams — 65 Cases,https://jpwebsite.harriscountytx.gov/WebDockets/GetDocketDetail?date=02/06/2025&court=71&media=screen#0900AM,2/6/2025 9:00am,2/6/2025 1:00pm,65,Judge Adams,2025,2025-02,2025-06,2025-02-06,Thursday,0,Harris County JP 7-1
Thu 2-6-2025 @ 9:00 am — Harris County JP 8-1 w/Judge Williamson — 39 Cases,https://jpwebsite.harriscountytx.gov/WebDockets/GetDocketDetail?date=02/06/2025&court=81&media=screen#0900AM,2/6/2025 9:00am,2/7/2025 4:30am,39,Judge Williamson,2025,2025-02,2025-06,2025-02-06,Thursday,0,Harris County JP 8-1
Fri 2-7-2025 @ 1:30 pm — Harris County JP 5-1 w/Judge Lombardino — 61 Cases,https://jpwebsite.harriscountytx.gov/WebDockets/GetDocketDetail?date=02/07/2025&court=51&media=screen#0130PM,2/7/2025 1:30pm,2/7/2025 2:00pm,61,Judge Lombardino,2025,2025-02,2025-06,2025-02-07,Friday,0,Harris County JP 5-1
Fri 2-7-2025 @ 9:00 am — Harris County JP 5-1 w/Judge Lombardino — 71 Cases,https://jpwebsite.harriscountytx.gov/WebDockets/GetDocketDetail?date=02/07/2025&court=51&media=screen#0900AM,2/7/2025 9:00am,2/7/2025 1:30pm,71,Judge Lombardino,2025,2025-02,2025-06,2025-02-07,Friday,0,Harris County JP 5-1
Fri 2-7-2025 @ 8:00 am — Harris County JP 6-2 w/Judge Rodriguez — 2 Cases,https://jpwebsite.harriscountytx.gov/WebDockets/GetDocketDetail?date=02/07/2025&court=62&media=screen#0800AM,2/7/2025 8:00am,2/7/2025 9:00am,2,Judge Rodriguez,2025,2025-02,2025-06,2025-02-07,Friday,0,Harris County JP 6-2
Fri 2-7-2025 @ 9:00 am — Harris County JP 6-2 w/Judge Rodriguez — 4 Cases,https://jpwebsite.harriscountytx.gov/WebDockets/GetDocketDetail?date=02/07/2025&court=62&media=screen#0900AM,2/7/2025 9:00am,2/7/2025 11:00am,4,Judge Rodriguez,2025,2025-02,2025-06,2025-02-07,Friday,0,Harris County JP 6-2
Mon 2-10-2025 @ 8:30 am — Harris County JP 1-1 w/Judge Carter — 25 Cases,https://jpwebsite.harriscountytx.gov/WebDockets/GetDocketDetail?date=02/10/2025&court=11&media=screen#0830AM,2/10/2025 8:30am,2/10/2025 9:30am,25,Judge Carter,2025,2025-02,2025-07,2025-02-10,Monday,0,Harris County JP 1-1
Mon 2-10-2025 @ 10:30 am — Harris County JP 1-1 w/Judge Carter — 12 Cases,https://jpwebsite.harriscountytx.gov/WebDockets/GetDocketDetail?date=02/10/2025&court=11&media=screen#1030AM,2/10/2025 10:30am,2/10/2025 11:30am,12,Judge Carter,2025,2025-02,2025-07,2025-02-10,Monday,0,Harris County JP 1-1
Mon 2-10-2025 @ 9:30 am — Harris County JP 1-1 w/Judge Carter — 21 Cases,https://jpwebsite.harriscountytx.gov/WebDockets/GetDocketDetail?date=02/10/2025&court=11&media=screen#0930AM,2/10/2025 9:30am,2/10/2025 10:30am,21,Judge Carter,2025,2025-02,2025-07,2025-02-10,Monday,0,Harris County JP 1-1
Mon 2-10-2025 @ 8:00 am — Harris County JP 2-1 w/Judge Delgado — 17 Cases,https://jpwebsite.harriscountytx.gov/WebDockets/GetDocketDetail?date=02/10/2025&court=21&media=screen#0800AM,2/10/2025 8:00am,2/10/2025 8:30am,17,Judge Delgado,2025,2025-02,2025-07,2025-02-10,Monday,0,Harris County JP 2-1
Mon 2-10-2025 @ 9:00 am — Harris County JP 4-1 w/Judge Goodwin — 121 Cases,https://jpwebsite.harriscountytx.gov/WebDockets/GetDocketDetail?date=02/10/2025&court=41&media=screen#0900AM,2/10/2025 9:00am,2/10/2025 10:00am,121,Judge Goodwin,2025,2025-02,2025-07,2025-02-10,Monday,0,Harris County JP 4-1
Mon 2-10-2025 @ 1:00 pm — Harris County JP 4-1 w/Judge Goodwin — 6 Cases,https://jpwebsite.harriscountytx.gov/WebDockets/GetDocketDetail?date=02/10/2025&court=41&media=screen#0100PM,2/10/2025 1:00pm,2/10/2025 2:00pm,6,Judge Goodwin,2025,2025-02,2025-07,2025-02-10,Monday,0,Harris County JP 4-1
Mon 2-10-2025 @ 8:30 am — Harris County JP 5-2 w/Judge Wolfe — 12 Cases,https://jpwebsite.harriscountytx.gov/WebDockets/GetDocketDetail?date=02/10/2025&court=52&media=screen#0830AM,2/10/2025 8:30am,2/10/2025 9:00am,12,Judge Wolfe,2025,2025-02,2025-07,2025-02-10,Monday,0,Harris County JP 5-2
Mon 2-10-2025 @ 2:30 pm — Harris County JP 5-2 w/Judge Wolfe — 67 Cases,https://jpwebsite.harriscountytx.gov/WebDockets/GetDocketDetail?date=02/10/2025&court=52&media=screen#0230PM,2/10/2025 2:30pm,2/10/2025 3:00pm,67,Judge Wolfe,2025,2025-02,2025-07,2025-02-10,Monday,0,Harris County JP 5-2
Mon 2-10-2025 @ 9:00 am — Harris County JP 6-2 w/Judge Rodriguez — 9 Cases,https://jpwebsite.harriscountytx.gov/WebDockets/GetDocketDetail?date=02/10/2025&court=62&media=screen#0900AM,2/10/2025 9:00am,2/12/2025 9:00am,9,Judge Rodriguez,2025,2025-02,2025-07,2025-02-10,Monday,0,Harris County JP 6-2
Tue 2-11-2025 @ 9:30 am — Harris County JP 1-1 w/Judge Carter — 24 Cases,https://jpwebsite.harriscountytx.gov/WebDockets/GetDocketDetail?date=02/11/2025&court=11&media=screen#0930AM,2/11/2025 9:30am,2/11/2025 10:30am,24,Judge Carter,2025,2025-02,2025-07,2025-02-11,Tuesday,0,Harris County JP 1-1
Tue 2-11-2025 @ 10:30 am — Harris County JP 1-1 w/Judge Carter — 22 Cases,https://jpwebsite.harriscountytx.gov/WebDockets/GetDocketDetail?date=02/11/2025&court=11&media=screen#1030AM,2/11/2025 10:30am,2/11/2025 11:30am,22,Judge Carter,2025,2025-02,2025-07,2025-02-11,Tuesday,0,Harris County JP 1-1
Tue 2-11-2025 @ 8:30 am — Harris County JP 1-1 w/Judge Carter — 26 Cases,https://jpwebsite.harriscountytx.gov/WebDockets/GetDocketDetail?date=02/11/2025&court=11&media=screen#0830AM,2/11/2025 8:30am,2/11/2025 9:30am,26,Judge Carter,2025,2025-02,2025-07,2025-02-11,Tuesday,0,Harris County JP 1-1
Tue 2-11-2025 @ 9:00 am — Harris County JP 1-2 w/Judge Duble — 9 Cases,https://jpwebsite.harriscountytx.gov/WebDockets/GetDocketDetail?date=02/11/2025&court=12&media=screen#0900AM,2/11/2025 9:00am,2/11/2025 10:30am,9,Judge Duble,2025,2025-02,2025-07,2025-02-11,Tuesday,0,Harris County JP 1-2
Tue 2-11-2025 @ 10:30 am — Harris County JP 1-2 w/Judge Duble — 3 Cases,https://jpwebsite.harriscountytx.gov/WebDockets/GetDocketDetail?date=02/11/2025&court=12&media=screen#1030AM,2/11/2025 10:30am,2/11/2025 1:00pm,3,Judge Duble,2025,2025-02,2025-07,2025-02-11,Tuesday,0,Harris County JP 1-2
Tue 2-11-2025 @ 1:00 pm — Harris County JP 1-2 w/Judge Duble — 2 Cases,https://jpwebsite.harriscountytx.gov/WebDockets/GetDocketDetail?date=02/11/2025&court=12&media=screen#0100PM,2/11/2025 1:00pm,2/11/2025 2:00pm,2,Judge Duble,2025,2025-02,2025-07,2025-02-11,Tuesday,0,Harris County JP 1-2
Tue 2-11-2025 @ 9:00 am — Harris County JP 4-1 w/Judge Goodwin — 29 Cases,https://jpwebsite.harriscountytx.gov/WebDockets/GetDocketDetail?date=02/11/2025&court=41&media=screen#0900AM,2/11/2025 9:00am,2/11/2025 10:00am,29,Judge Goodwin,2025,2025-02,2025-07,2025-02-11,Tuesday,0,Harris County JP 4-1
Tue 2-11-2025 @ 11:00 am — Harris County JP 5-1 w/Judge Lombardino — 23 Cases,https://jpwebsite.harriscountytx.gov/WebDockets/GetDocketDetail?date=02/11/2025&court=51&media=screen#1100AM,2/11/2025 11:00am,2/11/2025 8:00am,23,Judge Lombardino,2025,2025-02,2025-07,2025-02-11,Tuesday,0,Harris County JP 5-1
Tue 2-11-2025 @ 9:00 am — Harris County JP 5-1 w/Judge Lombardino — 47 Cases,https://jpwebsite.harriscountytx.gov/WebDockets/GetDocketDetail?date=02/11/2025&court=51&media=screen#0900AM,2/11/2025 9:00am,2/11/2025 9:30am,47,Judge Lombardino,2025,2025-02,2025-07,2025-02-11,Tuesday,0,Harris County JP 5-1
Tue 2-11-2025 @ 2:30 pm — Harris County JP 5-2 w/Judge Wolfe — 52 Cases,https://jpwebsite.harriscountytx.gov/WebDockets/GetDocketDetail?date=02/11/2025&court=52&media=screen#0230PM,2/11/2025 2:30pm,2/11/2025 3:00pm,52,Judge Wolfe,2025,2025-02,2025-07,2025-02-11,Tuesday,0,Harris County JP 5-2
Tue 2-11-2025 @ 8:30 am — Harris County JP 5-2 w/Judge Wolfe — 31 Cases,https://jpwebsite.harriscountytx.gov/WebDockets/GetDocketDetail?date=02/11/2025&court=52&media=screen#0830AM,2/11/2025 8:30am,2/11/2025 9:00am,31,Judge Wolfe,2025,2025-02,2025-07,2025-02-11,Tuesday,0,Harris County JP 5-2
Tue 2-11-2025 @ 9:00 am — Harris County JP 7-2 w/Judge Burney — 52 Cases,https://jpwebsite.harriscountytx.gov/WebDockets/GetDocketDetail?date=02/11/2025&court=72&media=screen#0900AM,2/11/2025 9:00am,2/11/2025 11:00am,52,Judge Burney,2025,2025-02,2025-07,2025-02-11,Tuesday,0,Harris County JP 7-2
Tue 2-11-2025 @ 11:00 am — Harris County JP 7-2 w/Judge Burney — 40 Cases,https://jpwebsite.harriscountytx.gov/WebDockets/GetDocketDetail?date=02/11/2025&court=72&media=screen#1100AM,2/11/2025 11:00am,2/11/2025 1:00pm,40,Judge Burney,2025,2025-02,2025-07,2025-02-11,Tuesday,0,Harris County JP 7-2
Wed 2-12-2025 @ 9:30 am — Harris County JP 1-1 w/Judge Carter — 20 Cases,https://jpwebsite.harriscountytx.gov/WebDockets/GetDocketDetail?date=02/12/2025&court=11&media=screen#0930AM,2/12/2025 9:30am,2/12/2025 10:30am,20,Judge Carter,2025,2025-02,2025-07,2025-02-12,Wednesday,0,Harris County JP 1-1
Wed 2-12-2025 @ 10:30 am — Harris County JP 1-1 w/Judge Carter — 15 Cases,https://jpwebsite.harriscountytx.gov/WebDockets/GetDocketDetail?date=02/12/2025&court=11&media=screen#1030AM,2/12/2025 10:30am,2/12/2025 11:30am,15,Judge Carter,2025,2025-02,2025-07,2025-02-12,Wednesday,0,Harris County JP 1-1
Wed 2-12-2025 @ 8:30 am — Harris County JP 1-1 w/Judge Carter — 21 Cases,https://jpwebsite.harriscountytx.gov/WebDockets/GetDocketDetail?date=02/12/2025&court=11&media=screen#0830AM,2/12/2025 8:30am,2/12/2025 9:30am,21,Judge Carter,2025,2025-02,2025-07,2025-02-12,Wednesday,0,Harris County JP 1-1
Wed 2-12-2025 @ 8:00 am — Harris County JP 2-1 w/Judge Delgado — 15 Cases,https://jpwebsite.harriscountytx.gov/WebDockets/GetDocketDetail?date=02/12/2025&court=21&media=screen#0800AM,2/12/2025 8:00am,2/12/2025 8:30am,15,Judge Delgado,2025,2025-02,2025-07,2025-02-12,Wednesday,0,Harris County JP 2-1
Wed 2-12-2025 @ 10:30 am — Harris County JP 3-1 w/Judge Stephens — 33 Cases,https://jpwebsite.harriscountytx.gov/WebDockets/GetDocketDetail?date=02/12/2025&court=31&media=screen#1030AM,2/12/2025 10:30am,2/12/2025 11:00am,33,Judge Stephens,2025,2025-02,2025-07,2025-02-12,Wednesday,0,Harris County JP 3-1
Wed 2-12-2025 @ 11:00 am — Harris County JP 3-1 w/Judge Stephens — 9 Cases,https://jpwebsite.harriscountytx.gov/WebDockets/GetDocketDetail?date=02/12/2025&court=31&media=screen#1100AM,2/12/2025 11:00am,2/12/2025 11:30am,9,Judge Stephens,2025,2025-02,2025-07,2025-02-12,Wednesday,0,Harris County JP 3-1
Wed 2-12-2025 @ 9:00 am — Harris County JP 3-1 w/Judge Stephens — 39 Cases,https://jpwebsite.harriscountytx.gov/WebDockets/GetDocketDetail?date=02/12/2025&court=31&media=screen#0900AM,2/12/2025 9:00am,2/12/2025 10:30am,39,Judge Stephens,2025,2025-02,2025-07,2025-02-12,Wednesday,0,Harris County JP 3-1
Wed 2-12-2025 @ 8:00 am — Harris County JP 5-1 w/Judge Lombardino — 1 Cases,https://jpwebsite.harriscountytx.gov/WebDockets/GetDocketDetail?date=02/12/2025&court=51&media=screen#0800AM,2/12/2025 8:00am,2/12/2025 8:30am,1,Judge Lombardino,2025,2025-02,2025-07,2025-02-12,Wednesday,0,Harris County JP 5-1
Wed 2-12-2025 @ 2:30 pm — Harris County JP 5-2 w/Judge Wolfe — 38 Cases,https://jpwebsite.harriscountytx.gov/WebDockets/GetDocketDetail?date=02/12/2025&court=52&media=screen#0230PM,2/12/2025 2:30pm,2/12/2025 3:00pm,38,Judge Wolfe,2025,2025-02,2025-07,2025-02-12,Wednesday,0,Harris County JP 5-2
Wed 2-12-2025 @ 9:00 am — Harris County JP 6-1 w/Judge Treviño — 25 Cases,https://jpwebsite.harriscountytx.gov/WebDockets/GetDocketDetail?date=02/12/2025&court=61&media=screen#0900AM,2/12/2025 9:00am,2/12/2025 1:00pm,25,Judge Treviño,2025,2025-02,2025-07,2025-02-12,Wednesday,0,Harris County JP 6-1
Wed 2-12-2025 @ 9:00 am — Harris County JP 7-1 w/Judge Adams — 43 Cases,https://jpwebsite.harriscountytx.gov/WebDockets/GetDocketDetail?date=02/12/2025&court=71&media=screen#0900AM,2/12/2025 9:00am,2/12/2025 9:30am,43,Judge Adams,2025,2025-02,2025-07,2025-02-12,Wednesday,0,Harris County JP 7-1
Thu 2-13-2025 @ 9:00 am — Harris County JP 1-1 w/Judge Carter — 20 Cases,https://jpwebsite.harriscountytx.gov/WebDockets/GetDocketDetail?date=02/13/2025&court=11&media=screen#0900AM,2/13/2025 9:00am,2/13/2025 10:00am,20,Judge Carter,2025,2025-02,2025-07,2025-02-13,Thursday,0,Harris County JP 1-1
Thu 2-13-2025 @ 8:00 am — Harris County JP 2-1 w/Judge Delgado — 15 Cases,https://jpwebsite.harriscountytx.gov/WebDockets/GetDocketDetail?date=02/13/2025&court=21&media=screen#0800AM,2/13/2025 8:00am,2/13/2025 8:30am,15,Judge Delgado,2025,2025-02,2025-07,2025-02-13,Thursday,0,Harris County JP 2-1
Thu 2-13-2025 @ 9:00 am — Harris County JP 2-2 w/Judge Lozano — 26 Cases,https://jpwebsite.harriscountytx.gov/WebDockets/GetDocketDetail?date=02/13/2025&court=22&media=screen#0900AM,2/13/2025 9:00am,2/13/2025 10:00am,26,Judge Lozano,2025,2025-02,2025-07,2025-02-13,Thursday,0,Harris County JP 2-2
Thu 2-13-2025 @ 9:00 am — Harris County JP 4-1 w/Judge Goodwin — 34 Cases,https://jpwebsite.harriscountytx.gov/WebDockets/GetDocketDetail?date=02/13/2025&court=41&media=screen#0900AM,2/13/2025 9:00am,2/13/2025 10:00am,34,Judge Goodwin,2025,2025-02,2025-07,2025-02-13,Thursday,0,Harris County JP 4-1
Thu 2-13-2025 @ 10:00 am — Harris County JP 4-2 w/Judge Korduba — 35 Cases,https://jpwebsite.harriscountytx.gov/WebDockets/GetDocketDetail?date=02/13/2025&court=42&media=screen#1000AM,2/13/2025 10:00am,2/13/2025 10:30am,35,Judge Korduba,2025,2025-02,2025-07,2025-02-13,Thursday,0,Harris County JP 4-2
Thu 2-13-2025 @ 2:00 pm — Harris County JP 4-2 w/Judge Korduba — 17 Cases,https://jpwebsite.harriscountytx.gov/WebDockets/GetDocketDetail?date=02/13/2025&court=42&media=screen#0200PM,2/13/2025 2:00pm,2/13/2025 2:30pm,17,Judge Korduba,2025,2025-02,2025-07,2025-02-13,Thursday,0,Harris County JP 4-2
Thu 2-13-2025 @ 11:00 am — Harris County JP 4-2 w/Judge Korduba — 42 Cases,https://jpwebsite.harriscountytx.gov/WebDockets/GetDocketDetail?date=02/13/2025&court=42&media=screen#1100AM,2/13/2025 11:00am,2/13/2025 11:30am,42,Judge Korduba,2025,2025-02,2025-07,2025-02-13,Thursday,0,Harris County JP 4-2
Thu 2-13-2025 @ 9:00 am — Harris County JP 5-1 w/Judge Lombardino — 46 Cases,https://jpwebsite.harriscountytx.gov/WebDockets/GetDocketDetail?date=02/13/2025&court=51&media=screen#0900AM,2/13/2025 9:00am,2/13/2025 9:30am,46,Judge Lombardino,2025,2025-02,2025-07,2025-02-13,Thursday,0,Harris County JP 5-1
Thu 2-13-2025 @ 1:30 pm — Harris County JP 5-1 w/Judge Lombardino — 24 Cases,https://jpwebsite.harriscountytx.gov/WebDockets/GetDocketDetail?date=02/13/2025&court=51&media=screen#0130PM,2/13/2025 1:30pm,2/13/2025 2:00pm,24,Judge Lombardino,2025,2025-02,2025-07,2025-02-13,Thursday,0,Harris County JP 5-1
Thu 2-13-2025 @ 8:30 am — Harris County JP 5-2 w/Judge Wolfe — 36 Cases,https://jpwebsite.harriscountytx.gov/WebDockets/GetDocketDetail?date=02/13/2025&court=52&media=screen#0830AM,2/13/2025 8:30am,2/13/2025 9:00am,36,Judge Wolfe,2025,2025-02,2025-07,2025-02-13,Thursday,0,Harris County JP 5-2
Thu 2-13-2025 @ 2:30 pm — Harris County JP 5-2 w/Judge Wolfe — 67 Cases,https://jpwebsite.harriscountytx.gov/WebDockets/GetDocketDetail?date=02/13/2025&court=52&media=screen#0230PM,2/13/2025 2:30pm,2/13/2025 3:00pm,67,Judge Wolfe,2025,2025-02,2025-07,2025-02-13,Thursday,0,Harris County JP 5-2
Thu 2-13-2025 @ 9:00 am — Harris County JP 7-1 w/Judge Adams — 43 Cases,https://jpwebsite.harriscountytx.gov/WebDockets/GetDocketDetail?date=02/13/2025&court=71&media=screen#0900AM,2/13/2025 9:00am,2/13/2025 9:30am,43,Judge Adams,2025,2025-02,2025-07,2025-02-13,Thursday,0,Harris County JP 7-1
Thu 2-13-2025 @ 9:00 am — Harris County JP 8-1 w/Judge Williamson — 24 Cases,https://jpwebsite.harriscountytx.gov/WebDockets/GetDocketDetail?date=02/13/2025&court=81&media=screen#0900AM,2/13/2025 9:00am,2/14/2025 3:00am,24,Judge Williamson,2025,2025-02,2025-07,2025-02-13,Thursday,0,Harris County JP 8-1
Fri 2-14-2025 @ 10:30 am — Harris County JP 3-2 w/Judge Bates — 18 Cases,https://jpwebsite.harriscountytx.gov/WebDockets/GetDocketDetail?date=02/14/2025&court=32&media=screen#1030AM,2/14/2025 10:30am,2/14/2025 12:00pm,18,Judge Bates,2025,2025-02,2025-07,2025-02-14,Friday,0,Harris County JP 3-2
Fri 2-14-2025 @ 9:00 am — Harris County JP 4-1 w/Judge Goodwin — 1 Cases,https://jpwebsite.harriscountytx.gov/WebDockets/GetDocketDetail?date=02/14/2025&court=41&media=screen#0900AM,2/14/2025 9:00am,2/14/2025 10:00am,1,Judge Goodwin,2025,2025-02,2025-07,2025-02-14,Friday,0,Harris County JP 4-1
Mon 2-17-2025 @ 9:30 am — Harris County JP 1-1 w/Judge Carter — 20 Cases,https://jpwebsite.harriscountytx.gov/WebDockets/GetDocketDetail?date=02/17/2025&court=11&media=screen#0930AM,2/17/2025 9:30am,2/17/2025 10:30am,20,Judge Carter,2025,2025-02,2025-08,2025-02-17,Monday,0,Harris County JP 1-1
Mon 2-17-2025 @ 8:30 am — Harris County JP 1-1 w/Judge Carter — 22 Cases,https://jpwebsite.harriscountytx.gov/WebDockets/GetDocketDetail?date=02/17/2025&court=11&media=screen#0830AM,2/17/2025 8:30am,2/17/2025 9:30am,22,Judge Carter,2025,2025-02,2025-08,2025-02-17,Monday,0,Harris County JP 1-1
Mon 2-17-2025 @ 10:30 am — Harris County JP 1-1 w/Judge Carter — 17 Cases,https://jpwebsite.harriscountytx.gov/WebDockets/GetDocketDetail?date=02/17/2025&court=11&media=screen#1030AM,2/17/2025 10:30am,2/17/2025 11:00am,17,Judge Carter,2025,2025-02,2025-08,2025-02-17,Monday,0,Harris County JP 1-1
Mon 2-17-2025 @ 8:00 am — Harris County JP 2-1 w/Judge Delgado — 23 Cases,https://jpwebsite.harriscountytx.gov/WebDockets/GetDocketDetail?date=02/17/2025&court=21&media=screen#0800AM,2/17/2025 8:00am,2/17/2025 9:00am,23,Judge Delgado,2025,2025-02,2025-08,2025-02-17,Monday,0,Harris County JP 2-1
Mon 2-17-2025 @ 1:00 pm — Harris County JP 4-1 w/Judge Goodwin — 37 Cases,https://jpwebsite.harriscountytx.gov/WebDockets/GetDocketDetail?date=02/17/2025&court=41&media=screen#0100PM,2/17/2025 1:00pm,2/17/2025 2:00pm,37,Judge Goodwin,2025,2025-02,2025-08,2025-02-17,Monday,0,Harris County JP 4-1
Mon 2-17-2025 @ 9:00 am — Harris County JP 4-1 w/Judge Goodwin — 108 Cases,https://jpwebsite.harriscountytx.gov/WebDockets/GetDocketDetail?date=02/17/2025&court=41&media=screen#0900AM,2/17/2025 9:00am,2/17/2025 10:00am,108,Judge Goodwin,2025,2025-02,2025-08,2025-02-17,Monday,0,Harris County JP 4-1
Mon 2-17-2025 @ 1:30 pm — Harris County JP 5-1 w/Judge Lombardino — 56 Cases,https://jpwebsite.harriscountytx.gov/WebDockets/GetDocketDetail?date=02/17/2025&court=51&media=screen#0130PM,2/17/2025 1:30pm,2/17/2025 2:00pm,56,Judge Lombardino,2025,2025-02,2025-08,2025-02-17,Monday,0,Harris County JP 5-1
Mon 2-17-2025 @ 8:30 am — Harris County JP 5-2 w/Judge Wolfe — 40 Cases,https://jpwebsite.harriscountytx.gov/WebDockets/GetDocketDetail?date=02/17/2025&court=52&media=screen#0830AM,2/17/2025 8:30am,2/17/2025 9:00am,40,Judge Wolfe,2025,2025-02,2025-08,2025-02-17,Monday,0,Harris County JP 5-2
Mon 2-17-2025 @ 2:30 pm — Harris County JP 5-2 w/Judge Wolfe — 87 Cases,https://jpwebsite.harriscountytx.gov/WebDockets/GetDocketDetail?date=02/17/2025&court=52&media=screen#0230PM,2/17/2025 2:30pm,2/17/2025 3:00pm,87,Judge Wolfe,2025,2025-02,2025-08,2025-02-17,Monday,0,Harris County JP 5-2
Mon 2-17-2025 @ 9:00 am — Harris County JP 6-2 w/Judge Rodriguez — 6 Cases,https://jpwebsite.harriscountytx.gov/WebDockets/GetDocketDetail?date=02/17/2025&court=62&media=screen#0900AM,2/17/2025 9:00am,2/17/2025 10:00am,6,Judge Rodriguez,2025,2025-02,2025-08,2025-02-17,Monday,0,Harris County JP 6-2
Mon 2-17-2025 @ 10:00 am — Harris County JP 6-2 w/Judge Rodriguez — 1 Cases,https://jpwebsite.harriscountytx.gov/WebDockets/GetDocketDetail?date=02/17/2025&court=62&media=screen#1000AM,2/17/2025 10:00am,2/17/2025 11:00am,1,Judge Rodriguez,2025,2025-02,2025-08,2025-02-17,Monday,0,Harris County JP 6-2
Tue 2-18-2025 @ 9:00 am — Harris County JP 1-1 w/Judge Carter — 25 Cases,https://jpwebsite.harriscountytx.gov/WebDockets/GetDocketDetail?date=02/18/2025&court=11&media=screen#0900AM,2/18/2025 9:00am,2/18/2025 9:30am,25,Judge Carter,2025,2025-02,2025-08,2025-02-18,Tuesday,0,Harris County JP 1-1
Tue 2-18-2025 @ 9:00 am — Harris County JP 1-2 w/Judge Duble — 12 Cases,https://jpwebsite.harriscountytx.gov/WebDockets/GetDocketDetail?date=02/18/2025&court=12&media=screen#0900AM,2/18/2025 9:00am,2/18/2025 10:30am,12,Judge Duble,2025,2025-02,2025-08,2025-02-18,Tuesday,0,Harris County JP 1-2
Tue 2-18-2025 @ 1:00 pm — Harris County JP 1-2 w/Judge Duble — 11 Cases,https://jpwebsite.harriscountytx.gov/WebDockets/GetDocketDetail?date=02/18/2025&court=12&media=screen#0100PM,2/18/2025 1:00pm,2/18/2025 1:30pm,11,Judge Duble,2025,2025-02,2025-08,2025-02-18,Tuesday,0,Harris County JP 1-2
Tue 2-18-2025 @ 10:30 am — Harris County JP 1-2 w/Judge Duble — 8 Cases,https://jpwebsite.harriscountytx.gov/WebDockets/GetDocketDetail?date=02/18/2025&court=12&media=screen#1030AM,2/18/2025 10:30am,2/18/2025 1:00pm,8,Judge Duble,2025,2025-02,2025-08,2025-02-18,Tuesday,0,Harris County JP 1-2
Tue 2-18-2025 @ 8:00 am — Harris County JP 2-1 w/Judge Delgado — 19 Cases,https://jpwebsite.harriscountytx.gov/WebDockets/GetDocketDetail?date=02/18/2025&court=21&media=screen#0800AM,2/18/2025 8:00am,2/18/2025 9:00am,19,Judge Delgado,2025,2025-02,2025-08,2025-02-18,Tuesday,0,Harris County JP 2-1
Tue 2-18-2025 @ 9:00 am — Harris County JP 4-1 w/Judge Goodwin — 92 Cases,https://jpwebsite.harriscountytx.gov/WebDockets/GetDocketDetail?date=02/18/2025&court=41&media=screen#0900AM,2/18/2025 9:00am,2/18/2025 10:00am,92,Judge Goodwin,2025,2025-02,2025-08,2025-02-18,Tuesday,0,Harris County JP 4-1
Tue 2-18-2025 @ 10:00 am — Harris County JP 4-2 w/Judge Korduba — 56 Cases,https://jpwebsite.harriscountytx.gov/WebDockets/GetDocketDetail?date=02/18/2025&court=42&media=screen#1000AM,2/18/2025 10:00am,2/18/2025 11:00am,56,Judge Korduba,2025,2025-02,2025-08,2025-02-18,Tuesday,0,Harris County JP 4-2
Tue 2-18-2025 @ 11:00 am — Harris County JP 4-2 w/Judge Korduba — 18 Cases,https://jpwebsite.harriscountytx.gov/WebDockets/GetDocketDetail?date=02/18/2025&court=42&media=screen#1100AM,2/18/2025 11:00am,2/18/2025 1:00pm,18,Judge Korduba,2025,2025-02,2025-08,2025-02-18,Tuesday,0,Harris County JP 4-2
Tue 2-18-2025 @ 2:00 pm — Harris County JP 4-2 w/Judge Korduba — 31 Cases,https://jpwebsite.harriscountytx.gov/WebDockets/GetDocketDetail?date=02/18/2025&court=42&media=screen#0200PM,2/18/2025 2:00pm,2/18/2025 3:00pm,31,Judge Korduba,2025,2025-02,2025-08,2025-02-18,Tuesday,0,Harris County JP 4-2
Tue 2-18-2025 @ 1:00 pm — Harris County JP 4-2 w/Judge Korduba — 15 Cases,https://jpwebsite.harriscountytx.gov/WebDockets/GetDocketDetail?date=02/18/2025&court=42&media=screen#0100PM,2/18/2025 1:00pm,2/18/2025 2:00pm,15,Judge Korduba,2025,2025-02,2025-08,2025-02-18,Tuesday,0,Harris County JP 4-2
Tue 2-18-2025 @ 9:00 am — Harris County JP 5-1 w/Judge Lombardino — 47 Cases,https://jpwebsite.harriscountytx.gov/WebDockets/GetDocketDetail?date=02/18/2025&court=51&media=screen#0900AM,2/18/2025 9:00am,2/18/2025 9:30am,47,Judge Lombardino,2025,2025-02,2025-08,2025-02-18,Tuesday,0,Harris County JP 5-1
Tue 2-18-2025 @ 2:30 pm — Harris County JP 5-2 w/Judge Wolfe — 78 Cases,https://jpwebsite.harriscountytx.gov/WebDockets/GetDocketDetail?date=02/18/2025&court=52&media=screen#0230PM,2/18/2025 2:30pm,2/18/2025 3:00pm,78,Judge Wolfe,2025,2025-02,2025-08,2025-02-18,Tuesday,0,Harris County JP 5-2
Tue 2-18-2025 @ 8:30 am — Harris County JP 5-2 w/Judge Wolfe — 45 Cases,https://jpwebsite.harriscountytx.gov/WebDockets/GetDocketDetail?date=02/18/2025&court=52&media=screen#0830AM,2/18/2025 8:30am,2/18/2025 9:00am,45,Judge Wolfe,2025,2025-02,2025-08,2025-02-18,Tuesday,0,Harris County JP 5-2
Tue 2-18-2025 @ 11:00 am — Harris County JP 7-2 w/Judge Burney — 43 Cases,https://jpwebsite.harriscountytx.gov/WebDockets/GetDocketDetail?date=02/18/2025&court=72&media=screen#1100AM,2/18/2025 11:00am,2/18/2025 12:30pm,43,Judge Burney,2025,2025-02,2025-08,2025-02-18,Tuesday,0,Harris County JP 7-2
Tue 2-18-2025 @ 9:00 am — Harris County JP 7-2 w/Judge Burney — 61 Cases,https://jpwebsite.harriscountytx.gov/WebDockets/GetDocketDetail?date=02/18/2025&court=72&media=screen#0900AM,2/18/2025 9:00am,2/18/2025 11:00am,61,Judge Burney,2025,2025-02,2025-08,2025-02-18,Tuesday,0,Harris County JP 7-2
Wed 2-19-2025 @ 10:30 am — Harris County JP 1-1 w/Judge Carter — 22 Cases,https://jpwebsite.harriscountytx.gov/WebDockets/GetDocketDetail?date=02/19/2025&court=11&media=screen#1030AM,2/19/2025 10:30am,2/19/2025 11:00am,22,Judge Carter,2025,2025-02,2025-08,2025-02-19,Wednesday,0,Harris County JP 1-1
Wed 2-19-2025 @ 9:30 am — Harris County JP 1-1 w/Judge Carter — 27 Cases,https://jpwebsite.harriscountytx.gov/WebDockets/GetDocketDetail?date=02/19/2025&court=11&media=screen#0930AM,2/19/2025 9:30am,2/19/2025 10:30am,27,Judge Carter,2025,2025-02,2025-08,2025-02-19,Wednesday,0,Harris County JP 1-1
Wed 2-19-2025 @ 8:30 am — Harris County JP 1-1 w/Judge Carter — 27 Cases,https://jpwebsite.harriscountytx.gov/WebDockets/GetDocketDetail?date=02/19/2025&court=11&media=screen#0830AM,2/19/2025 8:30am,2/19/2025 9:30am,27,Judge Carter,2025,2025-02,2025-08,2025-02-19,Wednesday,0,Harris County JP 1-1
Wed 2-19-2025 @ 8:00 am — Harris County JP 2-1 w/Judge Delgado — 22 Cases,https://jpwebsite.harriscountytx.gov/WebDockets/GetDocketDetail?date=02/19/2025&court=21&media=screen#0800AM,2/19/2025 8:00am,2/19/2025 9:00am,22,Judge Delgado,2025,2025-02,2025-08,2025-02-19,Wednesday,0,Harris County JP 2-1
Wed 2-19-2025 @ 9:00 am — Harris County JP 3-1 w/Judge Stephens — 50 Cases,https://jpwebsite.harriscountytx.gov/WebDockets/GetDocketDetail?date=02/19/2025&court=31&media=screen#0900AM,2/19/2025 9:00am,2/19/2025 10:30am,50,Judge Stephens,2025,2025-02,2025-08,2025-02-19,Wednesday,0,Harris County JP 3-1
Wed 2-19-2025 @ 10:30 am — Harris County JP 3-1 w/Judge Stephens — 35 Cases,https://jpwebsite.harriscountytx.gov/WebDockets/GetDocketDetail?date=02/19/2025&court=31&media=screen#1030AM,2/19/2025 10:30am,2/19/2025 9:00am,35,Judge Stephens,2025,2025-02,2025-08,2025-02-19,Wednesday,0,Harris County JP 3-1
Wed 2-19-2025 @ 2:30 pm — Harris County JP 3-2 w/Judge Bates — 1 Cases,https://jpwebsite.harriscountytx.gov/WebDockets/GetDocketDetail?date=02/19/2025&court=32&media=screen#0230PM,2/19/2025 2:30pm,2/19/2025 3:00pm,1,Judge Bates,2025,2025-02,2025-08,2025-02-19,Wednesday,0,Harris County JP 3-2
Wed 2-19-2025 @ 1:30 pm — Harris County JP 3-2 w/Judge Bates — 16 Cases,https://jpwebsite.harriscountytx.gov/WebDockets/GetDocketDetail?date=02/19/2025&court=32&media=screen#0130PM,2/19/2025 1:30pm,2/19/2025 2:30pm,16,Judge Bates,2025,2025-02,2025-08,2025-02-19,Wednesday,0,Harris County JP 3-2
Wed 2-19-2025 @ 9:00 am — Harris County JP 4-1 w/Judge Goodwin — 3 Cases,https://jpwebsite.harriscountytx.gov/WebDockets/GetDocketDetail?date=02/19/2025&court=41&media=screen#0900AM,2/19/2025 9:00am,2/19/2025 10:00am,3,Judge Goodwin,2025,2025-02,2025-08,2025-02-19,Wednesday,0,Harris County JP 4-1
Wed 2-19-2025 @ 9:00 am — Harris County JP 5-1 w/Judge Lombardino — 46 Cases,https://jpwebsite.harriscountytx.gov/WebDockets/GetDocketDetail?date=02/19/2025&court=51&media=screen#0900AM,2/19/2025 9:00am,2/19/2025 9:30am,46,Judge Lombardino,2025,2025-02,2025-08,2025-02-19,Wednesday,0,Harris County JP 5-1
Wed 2-19-2025 @ 9:00 am — Harris County JP 6-1 w/Judge Treviño — 22 Cases,https://jpwebsite.harriscountytx.gov/WebDockets/GetDocketDetail?date=02/19/2025&court=61&media=screen#0900AM,2/19/2025 9:00am,2/19/2025 1:00pm,22,Judge Treviño,2025,2025-02,2025-08,2025-02-19,Wednesday,0,Harris County JP 6-1
Wed 2-19-2025 @ 9:00 am — Harris County JP 7-1 w/Judge Adams — 67 Cases,https://jpwebsite.harriscountytx.gov/WebDockets/GetDocketDetail?date=02/19/2025&court=71&media=screen#0900AM,2/19/2025 9:00am,2/19/2025 9:30am,67,Judge Adams,2025,2025-02,2025-08,2025-02-19,Wednesday,0,Harris County JP 7-1
Thu 2-20-2025 @ 9:00 am — Harris County JP 1-1 w/Judge Carter — 30 Cases,https://jpwebsite.harriscountytx.gov/WebDockets/GetDocketDetail?date=02/20/2025&court=11&media=screen#0900AM,2/20/2025 9:00am,2/20/2025 9:30am,30,Judge Carter,2025,2025-02,2025-08,2025-02-20,Thursday,0,Harris County JP 1-1
Thu 2-20-2025 @ 8:00 am — Harris County JP 2-1 w/Judge Delgado — 10 Cases,https://jpwebsite.harriscountytx.gov/WebDockets/GetDocketDetail?date=02/20/2025&court=21&media=screen#0800AM,2/20/2025 8:00am,2/20/2025 9:00am,10,Judge Delgado,2025,2025-02,2025-08,2025-02-20,Thursday,0,Harris County JP 2-1
Thu 2-20-2025 @ 9:00 am — Harris County JP 2-2 w/Judge Lozano — 17 Cases,https://jpwebsite.harriscountytx.gov/WebDockets/GetDocketDetail?date=02/20/2025&court=22&media=screen#0900AM,2/20/2025 9:00am,2/20/2025 10:00am,17,Judge Lozano,2025,2025-02,2025-08,2025-02-20,Thursday,0,Harris County JP 2-2
Thu 2-20-2025 @ 8:00 am — Harris County JP 2-2 w/Judge Lozano — 3 Cases,https://jpwebsite.harriscountytx.gov/WebDockets/GetDocketDetail?date=02/20/2025&court=22&media=screen#0800AM,2/20/2025 8:00am,2/20/2025 9:00am,3,Judge Lozano,2025,2025-02,2025-08,2025-02-20,Thursday,0,Harris County JP 2-2
Thu 2-20-2025 @ 9:00 am — Harris County JP 3-1 w/Judge Stephens — 19 Cases,https://jpwebsite.harriscountytx.gov/WebDockets/GetDocketDetail?date=02/20/2025&court=31&media=screen#0900AM,2/20/2025 9:00am,2/20/2025 10:30am,19,Judge Stephens,2025,2025-02,2025-08,2025-02-20,Thursday,0,Harris County JP 3-1
Thu 2-20-2025 @ 10:30 am — Harris County JP 3-1 w/Judge Stephens — 28 Cases,https://jpwebsite.harriscountytx.gov/WebDockets/GetDocketDetail?date=02/20/2025&court=31&media=screen#1030AM,2/20/2025 10:30am,2/20/2025 11:00am,28,Judge Stephens,2025,2025-02,2025-08,2025-02-20,Thursday,0,Harris County JP 3-1
Thu 2-20-2025 @ 9:00 am — Harris County JP 4-1 w/Judge Goodwin — 24 Cases,https://jpwebsite.harriscountytx.gov/WebDockets/GetDocketDetail?date=02/20/2025&court=41&media=screen#0900AM,2/20/2025 9:00am,2/20/2025 10:00am,24,Judge Goodwin,2025,2025-02,2025-08,2025-02-20,Thursday,0,Harris County JP 4-1
Thu 2-20-2025 @ 1:30 pm — Harris County JP 5-1 w/Judge Lombardino — 73 Cases,https://jpwebsite.harriscountytx.gov/WebDockets/GetDocketDetail?date=02/20/2025&court=51&media=screen#0130PM,2/20/2025 1:30pm,2/20/2025 2:00pm,73,Judge Lombardino,2025,2025-02,2025-08,2025-02-20,Thursday,0,Harris County JP 5-1
Thu 2-20-2025 @ 8:30 am — Harris County JP 5-2 w/Judge Wolfe — 44 Cases,https://jpwebsite.harriscountytx.gov/WebDockets/GetDocketDetail?date=02/20/2025&court=52&media=screen#0830AM,2/20/2025 8:30am,2/20/2025 9:00am,44,Judge Wolfe,2025,2025-02,2025-08,2025-02-20,Thursday,0,Harris County JP 5-2
Thu 2-20-2025 @ 2:30 pm — Harris County JP 5-2 w/Judge Wolfe — 99 Cases,https://jpwebsite.harriscountytx.gov/WebDockets/GetDocketDetail?date=02/20/2025&court=52&media=screen#0230PM,2/20/2025 2:30pm,2/20/2025 3:00pm,99,Judge Wolfe,2025,2025-02,2025-08,2025-02-20,Thursday,0,Harris County JP 5-2
Thu 2-20-2025 @ 9:00 am — Harris County JP 6-2 w/Judge Rodriguez — 3 Cases,https://jpwebsite.harriscountytx.gov/WebDockets/GetDocketDetail?date=02/20/2025&court=62&media=screen#0900AM,2/20/2025 9:00am,2/20/2025 9:00am,3,Judge Rodriguez,2025,2025-02,2025-08,2025-02-20,Thursday,0,Harris County JP 6-2
Thu 2-20-2025 @ 9:00 am — Harris County JP 8-1 w/Judge Williamson — 21 Cases,https://jpwebsite.harriscountytx.gov/WebDockets/GetDocketDetail?date=02/20/2025&court=81&media=screen#0900AM,2/20/2025 9:00am,2/20/2025 10:00am,21,Judge Williamson,2025,2025-02,2025-08,2025-02-20,Thursday,0,Harris County JP 8-1
Fri 2-21-2025 @ 9:00 am — Harris County JP 4-1 w/Judge Goodwin — 1 Cases,https://jpwebsite.harriscountytx.gov/WebDockets/GetDocketDetail?date=02/21/2025&court=41&media=screen#0900AM,2/21/2025 9:00am,2/21/2025 10:00am,1,Judge Goodwin,2025,2025-02,2025-08,2025-02-21,Friday,0,Harris County JP 4-1
Fri 2-21-2025 @ 9:00 am — Harris County JP 6-2 w/Judge Rodriguez — 5 Cases,https://jpwebsite.harriscountytx.gov/WebDockets/GetDocketDetail?date=02/21/2025&court=62&media=screen#0900AM,2/21/2025 9:00am,2/21/2025 10:00am,5,Judge Rodriguez,2025,2025-02,2025-08,2025-02-21,Friday,0,Harris County JP 6-2
Mon 2-24-2025 @ 8:00 am — Harris County JP 2-1 w/Judge Delgado — 18 Cases,https://jpwebsite.harriscountytx.gov/WebDockets/GetDocketDetail?date=02/24/2025&court=21&media=screen#0800AM,2/24/2025 8:00am,2/24/2025 9:00am,18,Judge Delgado,2025,2025-02,2025-09,2025-02-24,Monday,0,Harris County JP 2-1
Mon 2-24-2025 @ 9:00 am — Harris County JP 4-1 w/Judge Goodwin — 16 Cases,https://jpwebsite.harriscountytx.gov/WebDockets/GetDocketDetail?date=02/24/2025&court=41&media=screen#0900AM,2/24/2025 9:00am,2/24/2025 10:00am,16,Judge Goodwin,2025,2025-02,2025-09,2025-02-24,Monday,0,Harris County JP 4-1
Mon 2-24-2025 @ 1:00 pm — Harris County JP 4-1 w/Judge Goodwin — 48 Cases,https://jpwebsite.harriscountytx.gov/WebDockets/GetDocketDetail?date=02/24/2025&court=41&media=screen#0100PM,2/24/2025 1:00pm,2/24/2025 2:00pm,48,Judge Goodwin,2025,2025-02,2025-09,2025-02-24,Monday,0,Harris County JP 4-1
Mon 2-24-2025 @ 2:30 pm — Harris County JP 5-2 w/Judge Wolfe — 81 Cases,https://jpwebsite.harriscountytx.gov/WebDockets/GetDocketDetail?date=02/24/2025&court=52&media=screen#0230PM,2/24/2025 2:30pm,2/24/2025 3:00pm,81,Judge Wolfe,2025,2025-02,2025-09,2025-02-24,Monday,0,Harris County JP 5-2
Mon 2-24-2025 @ 8:30 am — Harris County JP 5-2 w/Judge Wolfe — 25 Cases,https://jpwebsite.harriscountytx.gov/WebDockets/GetDocketDetail?date=02/24/2025&court=52&media=screen#0830AM,2/24/2025 8:30am,2/24/2025 9:00am,25,Judge Wolfe,2025,2025-02,2025-09,2025-02-24,Monday,0,Harris County JP 5-2
Mon 2-24-2025 @ 9:00 am — Harris County JP 6-2 w/Judge Rodriguez — 9 Cases,https://jpwebsite.harriscountytx.gov/WebDockets/GetDocketDetail?date=02/24/2025&court=62&media=screen#0900AM,2/24/2025 9:00am,2/25/2025 9:00am,9,Judge Rodriguez,2025,2025-02,2025-09,2025-02-24,Monday,0,Harris County JP 6-2
Tue 2-25-2025 @ 9:00 am — Harris County JP 1-1 w/Judge Carter — 28 Cases,https://jpwebsite.harriscountytx.gov/WebDockets/GetDocketDetail?date=02/25/2025&court=11&media=screen#0900AM,2/25/2025 9:00am,2/25/2025 9:30am,28,Judge Carter,2025,2025-02,2025-09,2025-02-25,Tuesday,0,Harris County JP 1-1
Tue 2-25-2025 @ 1:00 pm — Harris County JP 1-2 w/Judge Duble — 8 Cases,https://jpwebsite.harriscountytx.gov/WebDockets/GetDocketDetail?date=02/25/2025&court=12&media=screen#0100PM,2/25/2025 1:00pm,2/25/2025 2:00pm,8,Judge Duble,2025,2025-02,2025-09,2025-02-25,Tuesday,0,Harris County JP 1-2
Tue 2-25-2025 @ 9:00 am — Harris County JP 1-2 w/Judge Duble — 10 Cases,https://jpwebsite.harriscountytx.gov/WebDockets/GetDocketDetail?date=02/25/2025&court=12&media=screen#0900AM,2/25/2025 9:00am,2/25/2025 10:30am,10,Judge Duble,2025,2025-02,2025-09,2025-02-25,Tuesday,0,Harris County JP 1-2
Tue 2-25-2025 @ 2:00 pm — Harris County JP 1-2 w/Judge Duble — 9 Cases,https://jpwebsite.harriscountytx.gov/WebDockets/GetDocketDetail?date=02/25/2025&court=12&media=screen#0200PM,2/25/2025 2:00pm,2/25/2025 3:00pm,9,Judge Duble,2025,2025-02,2025-09,2025-02-25,Tuesday,0,Harris County JP 1-2
Tue 2-25-2025 @ 10:30 am — Harris County JP 1-2 w/Judge Duble — 5 Cases,https://jpwebsite.harriscountytx.gov/WebDockets/GetDocketDetail?date=02/25/2025&court=12&media=screen#1030AM,2/25/2025 10:30am,2/25/2025 1:00pm,5,Judge Duble,2025,2025-02,2025-09,2025-02-25,Tuesday,0,Harris County JP 1-2
Tue 2-25-2025 @ 8:00 am — Harris County JP 2-1 w/Judge Delgado — 17 Cases,https://jpwebsite.harriscountytx.gov/WebDockets/GetDocketDetail?date=02/25/2025&court=21&media=screen#0800AM,2/25/2025 8:00am,2/25/2025 9:00am,17,Judge Delgado,2025,2025-02,2025-09,2025-02-25,Tuesday,0,Harris County JP 2-1
Tue 2-25-2025 @ 9:00 am — Harris County JP 4-1 w/Judge Goodwin — 69 Cases,https://jpwebsite.harriscountytx.gov/WebDockets/GetDocketDetail?date=02/25/2025&court=41&media=screen#0900AM,2/25/2025 9:00am,2/25/2025 10:00am,69,Judge Goodwin,2025,2025-02,2025-09,2025-02-25,Tuesday,0,Harris County JP 4-1
Tue 2-25-2025 @ 11:00 am — Harris County JP 4-2 w/Judge Korduba — 13 Cases,https://jpwebsite.harriscountytx.gov/WebDockets/GetDocketDetail?date=02/25/2025&court=42&media=screen#1100AM,2/25/2025 11:00am,2/25/2025 1:00pm,13,Judge Korduba,2025,2025-02,2025-09,2025-02-25,Tuesday,0,Harris County JP 4-2
Tue 2-25-2025 @ 10:00 am — Harris County JP 4-2 w/Judge Korduba — 56 Cases,https://jpwebsite.harriscountytx.gov/WebDockets/GetDocketDetail?date=02/25/2025&court=42&media=screen#1000AM,2/25/2025 10:00am,2/25/2025 11:00am,56,Judge Korduba,2025,2025-02,2025-09,2025-02-25,Tuesday,0,Harris County JP 4-2
Tue 2-25-2025 @ 1:00 pm — Harris County JP 4-2 w/Judge Korduba — 21 Cases,https://jpwebsite.harriscountytx.gov/WebDockets/GetDocketDetail?date=02/25/2025&court=42&media=screen#0100PM,2/25/2025 1:00pm,2/25/2025 1:30pm,21,Judge Korduba,2025,2025-02,2025-09,2025-02-25,Tuesday,0,Harris County JP 4-2
Tue 2-25-2025 @ 9:00 am — Harris County JP 5-1 w/Judge Lombardino — 40 Cases,https://jpwebsite.harriscountytx.gov/WebDockets/GetDocketDetail?date=02/25/2025&court=51&media=screen#0900AM,2/25/2025 9:00am,2/25/2025 9:30am,40,Judge Lombardino,2025,2025-02,2025-09,2025-02-25,Tuesday,0,Harris County JP 5-1
Tue 2-25-2025 @ 2:30 pm — Harris County JP 5-2 w/Judge Wolfe — 72 Cases,https://jpwebsite.harriscountytx.gov/WebDockets/GetDocketDetail?date=02/25/2025&court=52&media=screen#0230PM,2/25/2025 2:30pm,2/25/2025 3:00pm,72,Judge Wolfe,2025,2025-02,2025-09,2025-02-25,Tuesday,0,Harris County JP 5-2
Tue 2-25-2025 @ 9:00 am — Harris County JP 7-2 w/Judge Burney — 46 Cases,https://jpwebsite.harriscountytx.gov/WebDockets/GetDocketDetail?date=02/25/2025&court=72&media=screen#0900AM,2/25/2025 9:00am,2/25/2025 12:00pm,46,Judge Burney,2025,2025-02,2025-09,2025-02-25,Tuesday,0,Harris County JP 7-2
Wed 2-26-2025 @ 8:30 am — Harris County JP 1-1 w/Judge Carter — 19 Cases,https://jpwebsite.harriscountytx.gov/WebDockets/GetDocketDetail?date=02/26/2025&court=11&media=screen#0830AM,2/26/2025 8:30am,2/26/2025 9:30am,19,Judge Carter,2025,2025-02,2025-09,2025-02-26,Wednesday,0,Harris County JP 1-1
